,Date,FirstName,Headline,Injured,Injured_Status,Injury_Detail,Injury_Location,Injury_Side,Injury_Type,LastName,ListItemCaption,ListItemDescription,ListItemPubDate,PlayerID,Position,Priority,RotoId,Team,TeamCode,UpdateId,lastUpdate,player_code
38 ,1511542628,Pat         ,Pat Connaughton: Gets starting nod Friday                         ,NO     ,Healthy       ,             ,               ,             ,           ,Connaughton     ,"Connaughton will start at small forward in Friday’s game against the Nets, Casey Holdahl of Blazers.com reports."                                                                                                          ,"This lineup change comes as a bit of surprise, as coach Terry Stotts will move Maurice Harkless to the bench in favor of Connaughton. It will be Connaughton's first start of the season and second of his career, and he could be in line for additional minutes with Harkless struggling to give the Blazers much on the offensive end this season. The former Notre Dame standout is shooting an impressive 42.3 percent from behind the arc this season."                                                                                                                                                                                                                                                                                                                         ,11/24/2017 6:57:08 AM ,1626192 ,G       ,3       ,3727  ,POR ,blazers     ,270608  ,11/24/2017 6:57:08 AM ,pat_connaughton
39 ,1511542568,Trevor      ,Trevor Booker: Appears set to play                                ,NO     ,Healthy       ,Sprain       ,               ,Left         ,Ankle      ,Booker          ,Booker (ankle) appears set to play in Friday’s game against Portland.                                                                                                                                                       ,"The Nets haven't officially confirmed Booker's status after deeming him probable on Thursday, but the widespread belief is that the forward will be available off the bench. Booker missed Wednesday's loss to Cleveland and was limited to only nine minutes in the team's previous game against Golden State."                                                                                                                                                                                                                                                                                                                                                                                                                                                                      ,11/24/2017 6:56:08 AM ,202344  ,F       ,3       ,3142  ,BKN ,nets        ,270607  ,11/24/2017 6:56:08 AM ,trevor_booker
40 ,1511542431,Maurice     ,Maurice Harkless: Moving to bench                                 ,NO     ,Healthy       ,             ,               ,             ,           ,Harkless        ,"Harkless will move to the bench for Friday’s game against the Nets, Blazers reporter Casey Holdahl reports."                                                                                                               ,"Terry Stotts will make a surprise change to the starting lineup, sending Harkless to the bench in favor of Pat Connaughton, who will make his first start of the season and second start of his career. While he's a versatile defender, Harkless has been a virtual non-factor on offense this season and is averaging only 4.5 points and 3.4 rebounds per game in the month of November."                                                                                                                                                                                                                                                                                                                                                                                          ,11/24/2017 6:53:51 AM ,203090  ,F       ,3       ,3314  ,POR ,blazers     ,270606  ,11/24/2017 6:53:51 AM ,maurice_harkless
41 ,1511541977,Joakim      ,Joakim Noah: Not on two-game road trip                            ,YES    ,Out           ,             ,               ,             ,Illness    ,Noah            ,"Noah will not travel with the Knicks on their two-game road trip due to an illness, Al Iannazzone of Newsday reports."                                                                                                     ,"While the illness will keep Noah out over the course of the weekend, he wasn't likely to be made active even if healthy. There is no word on when exactly coach Jeff Hornacek will allow Noah to return to active duty, but with the team continuing to play on a high level, there likely won't be much tinkering with lineups anytime soon."                                                                                                                                                                                                                                                                                                                                                                                                                                        ,11/24/2017 6:46:17 AM ,201149  ,C       ,3       ,2822  ,NYK ,knicks      ,270605  ,11/24/2017 6:46:17 AM ,joakim_noah
42 ,1511540605,Jeremy      ,Jeremy Lamb: Will start at shooting guard Friday                  ,NO     ,Healthy       ,             ,               ,             ,           ,Lamb            ,Lamb will start at shooting guard in Friday’s game against the Cavaliers.                                                                                                                                                   ,"With Nicolas Batum (elbow) out for Friday's contest, Lamb will make his return to the starting lineup. Lamb is coming off one of his best performances of the season in Wednesday's overtime win over the Wizards, as he scored 24 points to go along with seven rebounds, five assists and three blocked shots. Now, as a starter, Lamb should see even more opportunties on the offensive end, especially against a Cavaliers defense that has been leaky at times."                                                                                                                                                                                                                                                                                                                ,11/24/2017 6:23:25 AM ,203087  ,G       ,3       ,3319  ,CHA ,hornets     ,270604  ,11/24/2017 6:23:25 AM ,jeremy_lamb
43 ,1511540396,Nicolas     ,Nicolas Batum: Will not play Friday                               ,YES    ,Out           ,Bruise       ,               ,Left         ,Elbow      ,Batum           ,Batum (elbow) has been ruled out for Friday’s game against the Cavaliers.                                                                                                                                                   ,"Batum is still dealing with a contusion to the same elbow he injured prior to the start of the regular season, so it makes sense that the Hornets are taking precautionary measures with the swingman. Batum has not been given a specific timetable for recovery, but he said he feels fine, so it shouldn't be too long before he is back on the floor. In his absence, Jeremy Lamb will get the start at shooting guard while rookie Dwayne Bacon will likely see extended minutes off the bench."                                                                                                                                                                                                                                                                                 ,11/24/2017 6:19:56 AM ,201587  ,F       ,2       ,2821  ,CHA ,hornets     ,270603  ,11/24/2017 6:19:56 AM ,nicolas_batum
44 ,1511539547,Kyle        ,Kyle Kuzma: Goes for 17 points in loss                            ,NO     ,Healthy       ,             ,               ,             ,           ,Kuzma           ,"Kuzma tallied 17 points (7-17 FG, 3-7 3Pt), two rebound and a steal across 36 minutes in Wednesday’s 113-102 loss to the Kings."                                                                                           ,"Kuzma's strong play at the four continued Wednesday, although his contributions were primarily limited to scoring as opposed to rebounding, where he normally averages 6.3 rebounds per game.  Kuzma's stock will continue to be high as theLakers' second-leading scorer and should be considered at least a second-tier starter in all formats."                                                                                                                                                                                                                                                                                                                                                                                                                                    ,11/24/2017 6:05:47 AM ,        ,F       ,3       ,4167  ,LAL ,lakers      ,270602  ,11/24/2017 6:05:47 AM ,
45 ,1511539262,Lonzo       ,Lonzo Ball: Double-doubles in loss                                ,NO     ,Healthy       ,             ,               ,             ,           ,Ball            ,"Ball recorded 11 points (4-8 FG, 3-5 3Pt, 0-2 FT), 11 assists, seven rebounds and a steal across 37 minutes in Wednesday’s 113-102 loss to the Kings."                                                                     ,"Ball's roller-coaster rookie campaign continues, as his wild deviation in production swings from night-to-night.  Coach Luke Walton and the Lakers are potentially sacrificing a better record by pushing Ball into the starting rotation when Jordan Clarkson has clearly been the better point guard thus far this season, but that pattern will not change as long as the brochures and posters at the Staples Center feature Ball as the new face of the team. Each night is an adventure for Ball, so while you have to consider him, you have to expect the swings as well."                                                                                                                                                                                                    ,11/24/2017 6:01:02 AM ,        ,G       ,3       ,4110  ,LAL ,lakers      ,270601  ,11/24/2017 6:01:02 AM ,
46 ,1511536667,CJ          ,CJ Miles: Not with team Friday                                    ,YES    ,Out           ,             ,               ,             ,Personal   ,Miles           ,Miles is listed as out in the Raptors’ game notes for Friday’s matchup with the Pacers due to personal reasons.                                                                                                             ,"The fact that Miles is not with the team Friday does not bode well for his status Saturday with the Raptors traveling to Atlanta, but he should still be considered questionable until Toronto can provide an official update on Miles. With Miles out, minutes will open up on the wing for both Normal Powell and rookie OG Anunoby."                                                                                                                                                                                                                                                                                                                                                                                                                                               ,11/24/2017 5:17:47 AM ,101139  ,G       ,3       ,2627  ,TOR ,raptors     ,270600  ,11/24/2017 5:17:47 AM ,cj_miles
47 ,1511500970,Elfrid      ,Elfrid Payton: Collects second double-double of the season        ,NO     ,Healthy       ,             ,               ,             ,           ,Payton          ,"Payton totaled 10 points (4-9 FG, 0-3 3Pt, 2-7 FT), 13 assists, four rebounds, two steals and one block in 34 minutes during Wednesday’s 124-118 loss to the Timberwolves."                                                ,"Payton struggled with his shot against Minnesota, but made up for it by contributing across the board. He looks fully recovered from his hamstring injury, playing a season-high 34 minutes in the loss. While his assist and steal numbers have been nice, he has been terrible from the free-throw line, shooting just 33 percent over his last three games. He has also only shot 35 percent from the floor over the same period. While he is not a high volume scorer, these numbers will have a negative effect on your team, so should be monitored over the next few games."                                                                                                                                                                                                   ,11/23/2017 7:22:50 PM ,203901  ,G       ,3       ,3594  ,ORL ,magic       ,270599  ,11/23/2017 7:22:50 PM ,elfrid_payton
48 ,1511500646,Nikola      ,Nikola Vucevic: Puts up inefficient double-double in loss         ,NO     ,Healthy       ,             ,               ,             ,           ,Vucevic         ,"Vucevic finished with 11 points (5-13 FG, 1-4 3Pt), 14 rebounds, four assists and one block across 33 minutes in Wednesday’s 124-118 loss to Minnesota."                                                                   ,"Vucevic was cold from the floor on Wednesday, but salvaged his line with 14 rebounds and a block. He has been excellent so far this season, but has slowed down after his amazing start. Parallel to his form, the Magic have also regressed after their hot start, losing their last six consecutive games. Along with Aaron Gordon, Vucevic has added a three-point shot to his arsenal. This looks like it is here to stay, and something owners can rely on for the rest of the season."                                                                                                                                                                                                                                                                                          ,11/23/2017 7:17:26 PM ,202696  ,C       ,3       ,3212  ,ORL ,magic       ,270598  ,11/23/2017 7:17:26 PM ,nikola_vucevic
49 ,1511500162,Aaron       ,Aaron Gordon: Scores 26 points in loss                            ,NO     ,Healthy       ,             ,               ,             ,           ,Gordon          ,"Gordon tallied 26 points (11-18 FG, 2-8 3Pt, 2-3 FT), nine rebounds, three assists and one steal in 36 minutes during Wednesday’s 124-118 loss to the Timberwolves."                                                       ,"Gordon led the Magic in scoring again, while putting up another eight three-point attempts in the process. Gordon has had some inconsistencies in his game this season, but for the most part, has looked like the player owners had been hoping for. His scoring and rebounding are right where they should be, however, it would be nice to see his defensive numbers come up slightly. His three-point shooting has been a nice addition to his game. While his efficiency from beyond the arc is likely not sustainable, he clearly has the green light to put the ball up whenever he likes."                                                                                                                                                                                    ,11/23/2017 7:09:22 PM ,203932  ,F       ,3       ,3577  ,ORL ,magic       ,270597  ,11/23/2017 7:09:22 PM ,aaron_gordon
50 ,1511499830,Jeff        ,Jeff Teague: Continues to impress Wednesday                       ,NO     ,Healthy       ,             ,               ,             ,           ,Teague          ,"Teague recorded 22 points (6-11 FG, 1-2 3Pt, 9-10 FT), 11 assists, three assists, two steals and one block in 37 minutes during Wednesday’s 124-118 victory over the Magic."                                               ,"Teague was excellent again Wednesday, leading the Timberwolves to a hard-fought victory. Out of all the players who switched teams during the off-season, Teague appears to have settled in the quickest. His numbers have not really taken a hit, and in fact, his defensive numbers have actually improved. He is shooting the ball below his career mark, so that could come up at any stage, leaving him as a solid fantasy option in all formats. Those people who took him in the middle rounds of their draft, have to be pleasantly surprised."                                                                                                                                                                                                                               ,11/23/2017 7:03:50 PM ,201952  ,G       ,3       ,3025  ,MIN ,timberwolves,270596  ,11/23/2017 7:03:50 PM ,jeff_teague
51 ,1511499403,Karl-Anthony,Karl-Anthony Towns: Double-doubles in victory                     ,NO     ,Healthy       ,             ,               ,             ,           ,Towns           ,"Towns collected 18 points (7-11 FG, 2-3 3Pt, 2-3 FT), 13 rebounds and two assists across 36 minutes in Wednesday’s 124-118 victory over Orlando."                                                                          ,"Towns recorded another double-double, but failed to collect a block for the third time in four games. Towns has been solid this season, but appears to have taken a back seat on the offensive pecking order. He has only averaged 11 field-goal attempts over the last four games, well down from his 18 he was attempting last season. It will be interesting to see if this trend continues, or whether it is simply a feeling out period for his new teammates. It is something to keep an eye on for owners, and if it does indeed continue, it could slightly limit his fantasy ceiling."                                                                                                                                                                                       ,11/23/2017 6:56:43 PM ,1626157 ,C       ,3       ,3741  ,MIN ,timberwolves,270595  ,11/23/2017 6:56:43 PM ,karl-anthony_towns
52 ,1511499039,Taj         ,Taj Gibson: Scores season-high 24 points in victory               ,NO     ,Healthy       ,             ,               ,             ,           ,Gibson          ,"Gibson finished with 24 points (8-11 FG, 8-10 FT), nine rebounds, two assists, two steals and one block in 40 minutes during Wednesday’s 124-118 victory over the Magic."                                                  ,"After a dud in his last game, Gibson bounced back nicely, scoring a season-high 24 points on only 11 shot attempts. Gibson has been a nice fit for his new team, and has sneaky value in most fantasy formats. He will not blow you out of the water with his numbers, but can contribute across the board while maintaining good efficiency. He should really be owned in all leagues, until further notice."                                                                                                                                                                                                                                                                                                                                                                        ,11/23/2017 6:50:39 PM ,201959  ,F       ,3       ,3035  ,MIN ,timberwolves,270594  ,11/23/2017 6:50:39 PM ,taj_gibson
53 ,1511491666,Mike        ,Mike Muscala: Will remain sidelined Friday                        ,YES    ,Out           ,             ,               ,             ,Ankle      ,Muscala         ,"Muscala (ankle) will not play in Friday’s contest against the Knicks, KL Chouinard of the Hawks’ official site reports."                                                                                                   ,"Friday's absence will mark Muscala's tenth consecutive game missed. The Hawks have failed to provide a specific update on his recovery, so he will continue being considered day-to-day going forward. With fellow power forward Luke Babbitt (back) also set to miss Friday's contest, rookie John Collins figures to be the prime candidate to start at power forward."                                                                                                                                                                                                                                                                                                                                                                                                             ,11/23/2017 4:47:46 PM ,203488  ,C       ,3       ,3463  ,ATL ,hawks       ,270593  ,11/23/2017 4:47:46 PM ,mike_muscala
54 ,1511491372,Luke        ,Luke Babbitt: Out Friday vs. Knicks                               ,YES    ,Out           ,             ,               ,             ,Back       ,Babbitt         ,"Babbitt (back) has been ruled out for Friday’s game against the Knicks, KL Chouinard of the Hawks’ official site reports."                                                                                                 ,"Babbitt will miss his second consecutive game due to a back issue. He sustained the injury in Monday's loss to the Clippers. Rookie John Collins replaced him at power forward in the starting lineup Wednesday, and will presumably be the favorite to do so again. Babbitt's next opportunity to return will be Saturday versus the Raptors."                                                                                                                                                                                                                                                                                                                                                                                                                                       ,11/23/2017 4:42:52 PM ,202337  ,F       ,3       ,3106  ,ATL ,hawks       ,270592  ,11/23/2017 4:42:52 PM ,luke_babbitt
55 ,1511482512,Trevor      ,Trevor Booker: Probable to play vs. Blazers                       ,NO     ,Healthy       ,Sprain       ,               ,Left         ,Ankle      ,Booker          ,Booker (ankle) is considered probable for Friday’s game against the Blazers.                                                                                                                                                ,"Booker was held out of Wednesday's game against Cleveland with a sprained ankle, but at this point it looks as though he'll only miss one contest. Prior to the injury, the 29-year-old had strung together three straight double-digit scoring efforts, while averaging 6.0 rebounds per game during that span."                                                                                                                                                                                                                                                                                                                                                                                                                                                                     ,11/23/2017 2:15:12 PM ,202344  ,F       ,3       ,3142  ,BKN ,nets        ,270591  ,11/23/2017 2:15:12 PM ,trevor_booker
56 ,1511471640,Kentavious  ,Kentavious Caldwell-Pope: Leads team with 20 points in loss       ,NO     ,Healthy       ,             ,               ,             ,           ,Caldwell-Pope   ,"Caldwell-Pope recorded 20 points (7-12 FG, 4-6 3Pt, 2-2 FT), three assists, a rebound and a steal across 35 minutes in Wednesday’s 113-102 loss to the Kings."                                                             ,"Caldwell-Pope followed up a season-high 21 points against the Bulls with another great outing despite the disappointing loss.  His minutes have remained consistent through the first 16 games, but his output can be a bit under-the-radar due to players like Kyle Kuzma and Brandon Ingram taking up the spotlight in Los Angeles.  While he is widely owned in seasonal leagues, he is an intriguing GPP option and can also be utilized as a cheap option in cash games, depending on the matchup."                                                                                                                                                                                                                                                                              ,11/23/2017 11:14:00 AM,203484  ,G       ,3       ,3450  ,LAL ,lakers      ,270590  ,11/23/2017 11:14:00 AM,kentavious_caldwell-pope
