,Date,FirstName,Headline,Injured,Injured_Status,Injury_Detail,Injury_Location,Injury_Side,Injury_Type,LastName,ListItemCaption,ListItemDescription,ListItemPubDate,PlayerID,Position,Priority,RotoId,Team,TeamCode,UpdateId,lastUpdate,player_code
72,1511051895,Patrick,Patrick Beverley: Out Saturday vs. Hornets,YES,GTD,Soreness,,Right,Knee,Beverley,"Beverley (knee) has been ruled out for Saturday’s game against the Hornets, Michael Gallagher of NBC reports.","Beverley will miss his fourth straight contest due to a sore right knee, not much of a surprise considering the point guard was held out of last night's overtime loss to the Cavaliers. Look for Sindarius Thornwell and Austin Rivers to continue to start in the backcourt with Beverley sidelined.",11/18/2017 2:38:15 PM,201976,G,3,3072,LAC,clippers,270180,11/18/2017 2:38:15 PM,patrick_beverley
73,1511051379,Luke,Luke Babbitt: Will play Saturday vs. Celtics,YES,GTD,,,,,Babbitt,Babbitt (back) will be in the starting lineup Saturday against the Celtics.,Babbitt exited Wednesday's win over the Kings with back spasms but will return to the starting lineup Saturday night. Look for Ersan Ilyasova to come off the bench in the contest but he could see additional action if the Hawks' decide to monitor Babbitt's minutes.,11/18/2017 2:29:39 PM,202337,F,3,3106,ATL,hawks,270179,11/18/2017 2:29:39 PM,luke_babbitt
74,1511049797,James,James Ennis: Heads to bench,NO,Healthy,,,,,Ennis,Ennis will come of the bench for Saturday’s game against the Rockets.,"Ennis will head to the bench for Saturday's tilt as Chandler Parsons steps into the starting five for the first time all season. He's struggled over the previous five games, averaging 5.2 points and 3.6 rebounds across 28.8 minutes per contest. As Parsons starts to earn more playing time, Ennis' minutes could take a slight hit.",11/18/2017 2:03:17 PM,203516,F,3,3481,MEM,grizzlies,270178,11/18/2017 2:03:17 PM,james_ennis
75,1511049312,Luc,Luc Mbah a Moute: Available for limited action Saturday,NO,Healthy,,,,,Mbah a Moute,"Mbah a Moute (illness) will be available for Saturday’s game against the Grizzlies, but will likely be on a minutes limit, Jonathan Feigen of the Houston Chronicle reports.","Mbah a Moute has been dealing with an illness recently, but he's apparently feeling well enough to return after missing just one contest. He's averaged 8.4 points, 3.6 rebounds and 1.4 steals across 27.8 minutes per game this season, though he isn't expected to see that much run Saturday due to some lingering fatigue.",11/18/2017 1:55:12 PM,201601,F,3,2971,HOU,rockets,270177,11/18/2017 1:55:12 PM,luc_mbah_a_moute
76,1511049189,Chandler,Chandler Parsons: Starting Saturday vs. Rockets,NO,Healthy,,,,,Parsons,Parsons will start Saturday against the Rockets.,"Parsons makes his first start of the season Saturday night as James Ennis will head to the bench. Parsons has averaged just over 19 minutes per contest this season with the Grizzlies, but will likely see increased minutes as a starter.",11/18/2017 1:53:09 PM,202718,F,3,3223,MEM,grizzlies,270176,11/18/2017 1:53:09 PM,chandler_parsons
77,1511048907,Thabo,Thabo Sefolosha: Available Saturday vs. Magic,YES,GTD,,,,,Sefolosha,Sefolosha (knee) is available for Saturday’s tilt against the Magic.,"Sefolosha was questionable for the contest after missing Friday's loss to the Nets. The veteran should resume his role off the bench, where he has been averaging 7.5 points, 4.7 rebounds, 1.3 steals and 0.9 blocks in over 21 minutes a contest through 15 games this season.",11/18/2017 1:48:27 PM,200757,F,3,2732,UTA,jazz,270175,11/18/2017 1:48:27 PM,thabo_sefolosha
78,1511045989,DeAndre',DeAndre' Bembry: Available Saturday,YES,GTD,,,Not Specified,,Bembry,"Bembry (wrist) is available for Saturday’s game against the Celtics, Michael Cunningham of the Atlanta Journal-Constitution reports.","Bembry will be available, but there's no guarantee he'll play. Coach Mike Budenholzer said that if Bembry does take the floor, it will be in ""short bursts"" and his total minutes will be ""based on feel."" Until we know more about his potential role, he makes for a risky fantasy option.",11/18/2017 12:59:49 PM,1627761,F,3,3880,ATL,hawks,270174,11/18/2017 12:59:49 PM,deandre_bembry
79,1511044583,Ricky,Ricky Rubio: Will play and start Saturday,NO,Healthy,,,,,Rubio,"Rubio (Achilles) has been cleared to play during Saturday’s game against the Magic and will draw the start at point guard, Tony Jones of The Salt Lake Tribune reports.","Rubio missed the first end of a back-to-back set Friday against the Nets while nursing a sore Achilles. He's apparently feeling better, however, and will resume his normal role Saturday against the Magic. As a result of his return, Raul Neto is the candidate most likely to see his minutes decrease.",11/18/2017 12:36:23 PM,201937,G,3,3012,UTA,jazz,270173,11/18/2017 12:36:23 PM,ricky_rubio
80,1511044309,D.J.,D.J. Augustin: Active for Saturday's game,NO,Healthy,,,,,Augustin,Augustin (hamstring) will be available to play during Saturday’s game against the Jazz.,"Augustin missed the team's past seven games while nursing a strained left hamstring. The goal was to have him back by Monday, but he's beaten that timetable. He'll seemingly resume his usual role as a reserve point guard behind starter Elfrid Payton.",11/18/2017 12:31:49 PM,201571,G,3,2939,ORL,magic,270172,11/18/2017 12:31:49 PM,dj_augustin
81,1511044176,Kemba,Kemba Walker: Will play Saturday,NO,Healthy,,,Not Specified,,Walker,"Walker (wrist) has been cleared to play during Saturday’s game against the Clippers with no restrictions, Stephanie Ready of Fox Sports Southeast reports.","Walker sprained his left wrist during the first end of a back-to-back set Friday against the Bulls. It seemingly didn't give him too much discomfort at the time, as he still managed to drop 47 points. It was apparently bothering him after Saturday's morning shootaround, but ultimately, he's been cleared to take the floor against the Clippers.",11/18/2017 12:29:36 PM,202689,G,2,3189,CHA,hornets,270171,11/18/2017 12:29:36 PM,kemba_walker
82,1511039980,Mason,Mason Plumlee: Upgraded to probable Sunday,YES,GTD,Strain,,,Abdomen,Plumlee,"Plumlee (abdomen) has been upgraded from questionable to probable for Sunday’s game against the Lakers, T.J. McBride of Mile High Sports reports.","Plumlee was questionable heading into Friday's game against the Pelicans and ended up playing 19 minutes, so the fact that he's been upgraded to probable doesn't come as too much of a surprise. That said, look for confirmation of his status after Sunday's morning shootaround.",11/18/2017 11:19:40 AM,203486,C,3,3442,DEN,nuggets,270170,11/18/2017 11:19:40 AM,mason_plumlee
83,1511037375,Iman,Iman Shumpert: To miss a week,YES,Out,,,,Knee,Shumpert,"Shumpert is expected to miss 5-7 days in order to undergo treatment on his left knee,","Shumpert injured his knee in Friday's victory over the Clippers. He had been starting in place of injured guard Derrick Rose (ankle). The Cavlaiers play three games over the next week, so a likely potential return date for the 27-year-old would be Nov. 27 against the 76ers. . In the meantime, Jose Calderon could see some work at point guard, while LeBron James and Dwyane Wade figure to be even more relied on to produce.",11/18/2017 10:36:15 AM,202697,G,3,3213,CLE,cavaliers,270169,11/18/2017 10:36:15 AM,iman_shumpert
84,1511036867,Norman,Norman Powell: Doubtful Sunday,YES,Out,,,,Hip,Powell,Powell (hip) is doubtful for Sunday’s game against the Wizards.,"Powell has missed the team's past three games while nursing a hip injury. He seemingly hasn't made too much progress in his recovery, as it's unlikely he'll be able to take the floor Sunday. If he misses the game, expect OG Anunoby and C.J. Miles to continue seeing expanded roles.",11/18/2017 10:27:47 AM,1626181,G,3,3726,TOR,raptors,270168,11/18/2017 10:27:47 AM,norman_powell
85,1511036735,Serge,Serge Ibaka: Questionable Sunday,NO,Healthy,Inflammation,,Left,Knee,Ibaka,Ibaka (knee) is questionable for Sunday’s game against the Wizards.,"Ibaka missed Friday's game against the Knicks while nursing left knee inflammation. He's apparently made some progress in his recovery, however. Look for more word on his status following Sunday's morning shootaround.",11/18/2017 10:25:35 AM,201586,F,3,2965,TOR,raptors,270167,11/18/2017 10:25:35 AM,serge_ibaka
86,1511036037,Mason,Mason Plumlee: Questionable Sunday vs. Lakers,YES,GTD,Strain,,,Abdomen,Plumlee,"Plumlee (abdomen) is questionable for Sunday’s game against the Lakers, T.J. McBride of Mile High Sports reports.","Plumlee has been nursing a strained core since Friday, but still played during that day's game against the Pelicans, posting six points, six rebounds and two assists across 19 minutes of action. More word on his availability should emerge following Sunday's morning shootaround.",11/18/2017 10:13:57 AM,203486,C,3,3442,DEN,nuggets,270166,11/18/2017 10:13:57 AM,mason_plumlee
87,1511033032,John,John Wall: Questionable Sunday vs. Raptors,YES,Out,Not Specified,,,Knee,Wall,"Wall (knee) is questionable for Sunday’s tilt against the Raptors, Josh Lewenberg of TSN.ca reports.","Wall finished with eight points (3-12 FG, 2-7 3Pt) during Friday's loss, indicating afterward that fluid in his knee caused the poor outing. The severity of the issue isn't clear at the moment, but the team seemingly feels comfortable listing him as day-to-day. Expect more updates on his status following Sunday's morning shootaround.",11/18/2017 9:23:52 AM,202322,G,2,3097,WAS,wizards,270164,11/18/2017 9:23:52 AM,john_wall
88,1511032261,Ed,Ed Davis: Questionable Saturday with ankle injury,NO,Healthy,,,,Ankle,Davis,"Davis suffered an ankle injury during Friday’s game in Sacramento and is questionable for Saturday’s rematch against the Kings, Jason Quick of NBC Sports Northwest reports.","Davis was able to play through the injury Friday, seeing 22 minutes -- about two more than his average. More word should arrive on his availability closer to tipoff. If he's unable to play, Zach Collins would likely be a beneficiary.",11/18/2017 9:11:01 AM,202334,F,3,3111,POR,blazers,270163,11/18/2017 9:11:01 AM,ed_davis
89,1511030236,Zach,Zach LaVine: On track for contact practice Monday,YES,Out,Sprain,,Left,Knee,LaVine,"LaVine (knee) will visit his doctor Monday morning in Los Angeles with the anticipation of being cleared for contact practice later that day at UCLA, K.C. Johnson of the Chicago Tribune reports","Coach Fred Hoiberg noted Wednesday that LaVine ""should be cleared [for practice] hopefully this week"", so things seem to be going as planned. While there's certainly no rush to get LaVine back into games considering the Bulls' struggles, he's ahead of schedule in his recovery. Look for more updates Monday regarding his activity.",11/18/2017 8:37:16 AM,203897,G,3,3597,CHI,bulls,270162,11/18/2017 8:37:16 AM,zach_lavine
90,1511029279,David,David Nwaba: Out Sunday vs. Suns,YES,Out,Sprain,,Right,Ankle,Nwaba,"Nwaba (ankle) did not practice Saturday due to lingering soreness and will not play during Sunday’s game against the Suns, K.C. Johnson of the Chicago Tribune reports.","Nwaba will miss his sixth straight game Sunday while nursing a sprained right ankle. In his stead, Denzel Valentine, Jerian Grant and Kris Dunn will likely continue being the main beneficiaries of his absence.",11/18/2017 8:21:19 AM,1628021,G,3,4099,CHI,bulls,270161,11/18/2017 8:21:19 AM,
91,1511029139,Ricky,Ricky Rubio: Probable Saturday vs. Magic,NO,Healthy,Soreness,,,Achilles,Rubio,"Rubio (Achilles) is probable for Saturday’s tilt against the Magic, Tony Jones of The Salt Lake Tribune reports.","Rubio missed Friday's game against the Nets due to Achilles soreness, though that has seemingly subsided significantly. More word on his status should arrive closer to tipoff. But, if he's able to play, it would likely mean fewer minutes for Raul Neto. Rubio has struggled over his past five outings, posting just 8.2 points, 4.8 assists and 2.0 steals per contest.",11/18/2017 8:18:59 AM,201937,G,3,3012,UTA,jazz,270160,11/18/2017 8:18:59 AM,ricky_rubio
92,1511028965,Thabo,Thabo Sefolosha: Questionable Saturday,YES,GTD,Soreness,,Right,Knee,Sefolosha,"Seoflosha (knee) is listed as questionable for Saturday’s game against the Magic, Tony Jones of The Salt Lake Tribune reports.",Sefolosha missed Friday's loss to the Nets and is looking like a true game-time decision Saturday. Jonas Jerebko figures to see increased minutes again should Sefolosha remain sidelined. Expect an update on his status closer to tip-off.,11/18/2017 8:16:05 AM,200757,F,3,2732,UTA,jazz,270159,11/18/2017 8:16:05 AM,thabo_sefolosha
93,1511028284,Isaiah,Isaiah Taylor: Could miss two weeks with retina tear,YES,Out,,,,Eye,Taylor,"Taylor is expected to miss one-to-two weeks after being diagnosed with a retina tear, Michael Cunningham of the Atlanta Journal-Constitution reports.","Taylor was poked in the eye during Friday's practice. He's been playing a significant role on the Hawks this year, posting 6.2 points and 2.4 assists across 16.1 minutes per game. While he's sidelined, Malcolm Delaney is a strong candidate to absorb a significant chunk of his minutes, while it's possible the team opts to bring Tyler Dorsey or Josh Magette up from the G-League to help out.",11/18/2017 8:04:44 AM,1627819,G,3,3974,ATL,hawks,270158,11/18/2017 8:04:44 AM,
94,1511027406,Michael,Michael Kidd-Gilchrist: Off updated injury report Saturday,NO,Healthy,,,Not Specified,,Kidd-Gilchrist,Kidd-Gilchrist (ankle) has been cleared to play for Saturday’s game against the Clippers.,"Kidd-Gilchrist was originally listed on the injury report as probable with a right ankle sprain, though apparently is feeling well enough to play after the team's morning shootaround. Over the past three contests, he's posted 13.0 points and 5.0 rebounds across 28.3 minutes per game.",11/18/2017 7:50:06 AM,203077,F,3,3302,CHA,hornets,270157,11/18/2017 7:50:06 AM,michael_kidd-gilchrist
95,1511027148,Glenn,Glenn Robinson: No longer on crutches,YES,Out,Sprain,,Left,Ankle,Robinson,Robinson (ankle) has shed his crutches.,"This is a big step for Robinson, who underwent surgery to address a severely sprained left ankle in mid-October. He's not expected to return until January, though it's encouraging to see him back on the court, even if it's just short-range standstill shooting.",11/18/2017 7:45:48 AM,203922,F,3,3604,IND,pacers,270156,11/18/2017 7:45:48 AM,glenn_robinson_iii
96,1511026962,Kemba,Kemba Walker: Downgraded to questionable,NO,Healthy,Sprain,,Left,Wrist,Walker,Walker (wrist) has been downgraded from probable to questionable for Saturday’s game against the Clippers.,"Walker is dealing with a left wrist sprain, which he seemingly suffered on the first end of a back-to-back Friday against the Bulls, though he still managed to drop 47 points on 17-of-27 shooting. Apparently, morning shootaround didn't go as well as anticipated, however, as he's been downgraded from probable to questionable. If he's ultimately sidelined, Michael Carter-Williams and Malik Monk seem like the two candidates to play point guard. Nicolas Batum would probably see a significant share of the ballhandling duties as well.",11/18/2017 7:42:42 AM,202689,G,2,3189,CHA,hornets,270155,11/18/2017 7:42:42 AM,kemba_walker
97,1511026781,Buddy,Buddy Hield: Out Saturday,YES,Out,,,,Ankle,Hield,"Hield (ankle) will not play in Saturday’s rematch against the Trail Blazers, Jason Jones of The Sacramento Bee reports.","Hield sprained his ankle in Friday's victory over the Trail Blazers, so his absence Saturday is unsurprising. Garrett Temple and Bogdon Bogdanovic figure to see extra minutes in HIelds absence, while rookie Justin Jackson could see an increased role as well. Consider Hield day-to-day going forward.",11/18/2017 7:39:41 AM,1627741,G,3,3884,SAC,kings,270154,11/18/2017 7:39:41 AM,buddy_hield
98,1511026622,Vince,Vince Carter: Out again Saturday,YES,Out,,,,Illness,Carter,"Carter (illness) will not play Saturday against the Trail Blazers, Jason Jones of The Sacramento Bee reports.","Carter has missed five straight games while battling kidney stones. While Carter remains out, look for rookie Justin Jackson to continue seeing extra run.",11/18/2017 7:37:02 AM,1713,G,3,1891,SAC,kings,270153,11/18/2017 7:37:02 AM,vince_carter
99,1511025979,Joel,Joel Bolomboy: At Bucks' shootaround Saturday,NO,Healthy,,,,,Bolomboy,"Bolomboy was present for the Bucks’ morning shootaround in advance of Saturday’s game against the Mavericks and can be presumed active, Matt Velazquez of the Milwaukee Journal Sentinel reports.","With both Matthew Dellavedova (knee) and Mirza Teletovic (knee) out Saturday, the Bucks have opted to bring Gary Payton and Bolomboy to shootaround, likely to prep them to play if needed. If Bolomboy touches the floor, it would be the first time at the NBA level this season.",11/18/2017 7:26:19 AM,1627762,F,4,3897,MIL,bucks,270152,11/18/2017 7:26:19 AM,joel_bolomboy
100,1511025542,Michael,Michael Kidd-Gilchrist: Listed as probable Saturday,NO,Healthy,Sprain,,Right,Ankle,Kidd-Gilchrist,Kidd-Gilchrist is probable for Saturday’s game against the Clippers due to a right ankle sprain.,"Kidd-Gilchrist likely suffered the injury during Friday's game against the Bulls, though still played 27 minutes -- nothing unusually low for him. More word on his status should emerge closer to tipoff. On the off chance he misses the game, Jeremy Lamb and Dwayne Bacon would probably be the main beneficiaries.",11/18/2017 7:19:02 AM,203077,F,3,3302,CHA,hornets,270151,11/18/2017 7:19:02 AM,michael_kidd-gilchrist
101,1511025308,Mirza,Mirza Teletovic: Out Saturday,YES,GTD,Soreness,,Left,Knee,Teletovic,"Teletovic (knee) will not play in Saturday’s game against the Mavericks, Matt Velazquez of the Milwaukee Journal Sentinel reports.","The absence will mark Teltovic's fifth consecutive game missed due to a knee issue. However, the sharp shooting big man did resume on-court workouts during the week, so he appears to be nearing a return.",11/18/2017 7:15:08 AM,203141,F,3,3398,MIL,bucks,270150,11/18/2017 7:15:08 AM,mirza_teletovic
102,1511025226,Kemba,Kemba Walker: Listed as probable Saturday,NO,Healthy,Sprain,,Left,Wrist,Walker,Walker is probable for Saturday’s game against the Clippers due to a left wrist sprain.,"Walker probably suffered the injury during Friday's game against the Bulls, but still managed to drop 47 points on 17-of-27 shooting. Look for more word on his status as tipoff nears, though it's likely he'll play. Regardless, if he's ultimately held out, Michael Carter-Williams and Malik Monk would seemingly hold down the fort at the point guard slot.",11/18/2017 7:13:46 AM,202689,G,3,3189,CHA,hornets,270149,11/18/2017 7:13:46 AM,kemba_walker
103,1511025175,Matthew,Matthew Dellavedova: Not with team Saturday,YES,Out,Tendinitis,,Left,Knee,Dellavedova,"Dllavedova (knee) is not with the Bucks in Dallas for their game against the Mavericks on Saturday, Matt Velazquez of the Milwaukee Journal Sentinel reports.","Dellavedova will miss his second consecutive game while nursing a knee injury. Eric Bledsoe and Malcolm Brogdon figure to continue seeing heavy minutes in the backcourt as a result, while Gary Payton is with the team to potentially help provide depth. Even when Dellavedova returns, his minutes will presumably continue taking a hit due to the recent addition of Bledsoe.",11/18/2017 7:12:55 AM,203521,G,3,3508,MIL,bucks,270148,11/18/2017 7:12:55 AM,matthew_dellavedova
104,1511023795,Jerryd,Jerryd Bayless: May return Monday,YES,GTD,Soreness,,Left,Wrist,Bayless,"Bayless (wrist) is out for Saturday’s game against the Warriors and should be tentatively considered questionable for Monday’s game against the Jazz, Kyle Neubeck of PhillyVoice.com reports.","Bayless will miss his sixth straight game Saturday as he continues to battle back from left wrist soreness. From the sound of it, however, Bayless may be back as soon as Monday's game against the Jazz. More updates on his status should emerge following the team's morning shootaround that day.",11/18/2017 6:49:55 AM,201573,G,3,2924,PHI,sixers,270147,11/18/2017 6:49:55 AM,jerryd_bayless
105,1511023261,Jarell,Jarell Martin: Recalled from G-League,NO,Healthy,,,,,Martin,Martin was recalled from the G-League’s Memphis Hustle on Saturday.,"With starting power forward JaMychal Green making his return from an ankle injury Wednesday, Martin's role will likely be reduced moving forward. Even in deep leagues, it seems somewhat inadvisable to keep Martin around, since he was averaging just 5.0 points and 4.2 rebounds across 20.8 minutes per game prior to Green's return.",11/18/2017 6:41:01 AM,1626185,F,3,3715,MEM,grizzlies,270146,11/18/2017 6:41:01 AM,jarell_martin
106,1511023055,Deyonta,Deyonta Davis: Recalled from G-League,NO,Healthy,,,,,Davis,Davis was recalled from the G-League’s Memphis Hustle on Saturday.,"Davis had played just eight minutes at the NBA level when he was sent to the G-League, so the team is likely hoping he gained valuable experience in the process. That said, it's still unlikely he sees significant run moving forward.",11/18/2017 6:37:35 AM,1627738,F,4,3868,MEM,grizzlies,270145,11/18/2017 6:37:35 AM,deyonta_davis
107,1511022937,Brook,Brook Lopez: Double-double in Friday's loss,NO,Healthy,,,,,Lopez,"Lopez scored 19 points (8-13 FG, 2-6 3Pt, 1-2 FT) while adding 10 rebounds, four blocks and three assists in 31 minutes during Friday’s 122-113 loss to the Suns.","He continues to bring some veteran stability to a very young Lakers roster. Lopez now has four double-doubles through 16 games, although he hasn't pulled down more than six boards in any of the other 12 contests, while the four blocks were also a season high.",11/18/2017 6:35:37 AM,201572,C,3,2918,LAL,lakers,270144,11/18/2017 6:35:37 AM,brook_lopez
108,1511022753,Kyle,Kyle Kuzma: Erupts for career-high 30 in Friday's loss,NO,Healthy,,,,,Kuzma,"Kuzma scored 30 points (11-23 FG, 2-7 3Pt, 6-7 FT) while adding 10 rebounds and an assist in 38 minutes during Friday’s 122-113 loss to the Suns.","It's the rookie's fifth double-double of the season, while the 30 points were a new career high. Kuzma has seized control of the starting power forward spot for the Lakers, averaging 18.3 points, 8.6 boards and 1.1 three-pointers in nine November games.",11/18/2017 6:32:33 AM,,F,3,4167,LAL,lakers,270143,11/18/2017 6:32:33 AM,
109,1511022325,Luc,Luc Mbah a Moute: Questionable Saturday,NO,Healthy,,,,Illness,Mbah a Moute,"Mbah a Moute (illness) is listed as questionable for Saturday’s game against the Grizzlies, Jonathan Feigen of the Houston Chronicle reports.","Mbah a Moute was sidelined for Thursday's victory over the Suns due to an illness, and his status Saturday looks like it is unlikely to be determined until closer to game-time. P.J. Tucker would presumably see a bigger role backing up Trevor Ariza at small forward should Mbah a Moute ultimately remain sidelined.",11/18/2017 6:25:25 AM,201601,F,3,2971,HOU,rockets,270142,11/18/2017 6:25:25 AM,luc_mbah_a_moute
110,1511022204,Alex,Alex Len: Big double-double in Friday's win,NO,Healthy,,,,,Len,"Len scored 17 points (6-10 FG, 5-6 FT) while adding 18 rebounds, two assists and two blocks in 27 minutes off the bench during Friday’s 122-113 win over the Lakers.","Tyson Chandler's recent illness didn't push Len into the starting lineup, but it did allow him to show what he can do on the glass. The 24-year-old center has averaged 13.0 points, 15.5 boards and 1.0 blocks over the last two games with Chandler sidelined, giving a glimpse of his fantasy ceiling should the veteran be removed from the Suns' depth chart on a more permanent basis.",11/18/2017 6:23:24 AM,203458,C,3,3436,PHX,suns,270141,11/18/2017 6:23:24 AM,alex_len
111,1511022015,Devin,Devin Booker: Scores game-high 33 in Friday's win,NO,Healthy,,,,,Booker,"Booker scored 33 points (13-27 FG, 6-14 3Pt, 1-3 FT) while adding four assists and three rebounds in 33 minutes during Friday’s 122-113 win over the Lakers.","He continues to emerge as one of the NBA's top scorers without Eric Bledsoe to curtail his usage, and Booker's now averaging 25.8 points, 4.4 assists, 3.8 boards and 2.8 three-pointers over his last 12 games. Expect the 21-year-old to continue doing his best to carry the Suns' offense on his back.",11/18/2017 6:20:15 AM,1626164,G,3,3711,PHX,suns,270140,11/18/2017 6:20:15 AM,devin_booker
112,1511021967,Furkan,Furkan Korkmaz: Recalled from G-League,NO,Healthy,,,,,Korkmaz,"Korkmaz will be recalled from the G-League’s Delaware 87ers in advance of the 76ers’ matchup against the Warriors on Saturday, Keith Pompey of The Philadelphia Inquirer reports.","While Korkmaz has struggled to find playing time at the NBA level, that hasn't been the case in the G-League. There, he's averaging 13.0 points, 6.5 rebounds, 4.5 assists and 1.5 steals across 31.0 minutes per game. While his 33.3 percent field-goal percentage is leaving something to be desired, he's played just two games, so there's plenty of time to give that a boost.",11/18/2017 6:19:27 AM,1627788,G,3,3887,PHI,sixers,270139,11/18/2017 6:19:27 AM,furkan_korkmaz
113,1511021836,Isaiah,Isaiah Taylor: Could miss multiple games,YES,Out,Bruise,,,Eye,Taylor,"Taylor (eye) will not play in Saturday’s game against the Celtics, and could miss a few more, Michael Cunningham of the Atlanta Journal-Constitution reports.","Taylor was poked in the eye at Friday's practice. The reserve point guard has been out of the Hawks' rotation, so his absence does not figure to have much of an impact.",11/18/2017 6:17:16 AM,1627819,G,3,3974,ATL,hawks,270138,11/18/2017 6:17:16 AM,
