,Date,FirstName,Headline,Injured,Injured_Status,Injury_Detail,Injury_Location,Injury_Side,Injury_Type,LastName,ListItemCaption,ListItemDescription,ListItemPubDate,PlayerID,Position,Priority,RotoId,Team,TeamCode,UpdateId,lastUpdate,player_code
36,1511113310,Damyean,Damyean Dotson: Assigned to G-League,NO,Healthy,,,,,Dotson,"Dotson was assigned to the G-Leauge on Sunday, Al Iannazzone of Newsday reports.","Dotson has seen double digit minutes twice at the NBA level this season, scoring nine points and fourteen points in those contests, however he will spend most of the season in the G-League, where he is averaging 13.5 points and 9.0 rebounds over 38.2 minutes.",11/19/2017 7:41:50 AM,,G,4,4198,NYK,knicks,270216,11/19/2017 7:41:50 AM,
37,1511111794,Anthony,Anthony Davis: Probable for Monday,YES,GTD,Not Specified,,Not Specified,Forehead,Davis,"Davis (face) is listed as probable for Monday’s game against the Thunder, Marc J. Spears of ESPN reports.","While Davis was pulled from Friday's game against the Nuggets with a concussion, he's reportedly since been cleared of the concussion diagnosis and is now just dealing with a contusion of the orbit bone above his right eye. He's likely just got some overall soreness and swelling to the area, but the the fact that he's passed concussion protocol is very encouraging for his status on Monday. If all goes as expected, Davis should take the floor as usual, though another update will likely be provided following the team's morning shootaround.",11/19/2017 7:16:34 AM,203076,F,2,3297,NOP,pelicans,270215,11/19/2017 7:16:34 AM,anthony_davis
38,1511110666,Bruno,Bruno Caboclo: Recalled from G-League,NO,Healthy,,,,,Caboclo,Caboclo was recalled from the G-League on Sunday.,"Caboclo has seen action in just two games at the NBA level this season, meaning this call-up is likely just to provide the Raptors with depth. He's spent most of this season with the Raptors 905, where he's averaging 18.6 points and 7.2 rebounds over 33.0 minutes. .",11/19/2017 6:57:46 AM,203998,F,4,3673,TOR,raptors,270214,11/19/2017 6:57:46 AM,bruno_caboclo
39,1511110318,Alfonzo,Alfonzo McKinnie: Recalled from G-League,NO,Healthy,,,,,McKinnie,McKinnie was recalled from the G-League on Sunday.,"McKinnie has now played in four games with the Raptors' G-League affiliate, averaging 16.0 points, 8.0 rebounds, 1.0 assist and 1.3 steals across 33.3 minutes. That strong play has earned him a call-up to the big club, though he's yet to see double-digit minutes with the Raptors this season and will likely remain outside the regular rotation moving forward.",11/19/2017 6:51:58 AM,,F,4,4213,TOR,raptors,270213,11/19/2017 6:51:58 AM,
40,1511109958,Mario,Mario Hezonja: Sees 14 minutes Saturday,NO,Healthy,,,,,Hezonja,"Hezonja recorded four points (2-8 FG, 0-2 3Pt), four rebounds, one block and one steal over 15 minutes Saturday in a loss to the Jazz.","Hezonja was able to go after being listed as probable for Saturday's game with a head laceration. He's been an afterthought in Orlando's rotation this season, scoring double digit points just once this season.",11/19/2017 6:45:58 AM,1626209,G,3,3578,ORL,magic,270212,11/19/2017 6:45:58 AM,mario_hezonja
41,1511109798,Kevin,Kevin Durant: Out Sunday with ankle sprain,YES,Out,Sprain,,Left,Ankle,Durant,"Durant is dealing with a left ankle sprain and has been ruled out for Sunday’s game against the Nets, Chris Haynes of ESPN reports.","It's unclear exactly when Durant picked up the injury, but it likely occurred during Saturday's game against the 76ers. With the Warriors heading into the second game of their back-to-back set, they'll try and avoid having Durant aggravate the injury further and keep him on the sidelines. Durant's next opportunity to play will be Wednesday against the Thunder, though in the meantime, look for Andre Iguodala, Patrick McCaw and Omri Casspi to help cover his minutes.",11/19/2017 6:43:18 AM,201142,F,1,2811,GSW,warriors,270211,11/19/2017 6:43:18 AM,kevin_durant
42,1511108463,Tim,Tim Hardaway: Questionable for Monday,YES,GTD,,,Left,Foot,Hardaway,"Hardaway is questionable for Monday’s matchup with the Clippers with a sore left foot, Al Iannazzone of Newsday reports.","Hardaway sat out of Sunday's practice with a sore left foot, and at this point, is questionable for Monday's game. He underwent X-rays on the foot after Friday's game and they came back negative, so the injury doesn't seem to be too significant at this point, however more information should come out prior to Monday's contest.",11/19/2017 6:21:03 AM,203501,G,3,3459,NYK,knicks,270210,11/19/2017 6:21:03 AM,timothy_hardaway
43,1511099352,Dwight,Dwight Howard: Collects double-double Saturday,NO,Healthy,,,,,Howard,"Howard scored 16 points (7-10 FG, 2-6 FT) to go along with 16 rebounds, one assist, two steals and one block over 29 minutes in Saturday’s 102-87 win against the Clippers.","Howard collected 16 rebounds in order to clinch his seventh double-double of the season. The veteran center had a dominating night on the defensive glass, collecting 12 rebounds on defense. While he may not average 20-plus points game as he did with Orlando in 2011-12, Howard is averaging a mighty 12.5 rebounds this season. Howard looks to add to this rebound totals when Charlotte takes on Minnesota on Monday.",11/19/2017 3:49:12 AM,2730,C,3,2458,CHA,hornets,270209,11/19/2017 3:49:12 AM,dwight_howard
44,1511084648,Khris,Khris Middleton: Efficient in loss,NO,Healthy,,,,,Middleton,"Middleton totaled 23 points (9-12 FG) 3-5 3Pt, 2-2 FT), two assists and one steal in 32 minutes during Saturday’s 111-79 loss to the Mavericks.","Middleton joined Giannis Antetokounmpo as the only Bucks player to score in double figures during a blow-out loss. He finished with 23 points on only 12 field-goal attempts, but was not able to add much else to his stat line. He has slowly been rounding into form, and is clearly the second option on offense.",11/18/2017 11:44:08 PM,203114,G,3,3356,MIL,bucks,270208,11/18/2017 11:44:08 PM,khris_middleton
45,1511084401,Giannis,Giannis Antetokounmpo: Pull down season-high 17 rebounds,NO,Healthy,,,,,Antetokounmpo,"Antetokounmpo finished with 24 points (7-20 FG, 1-3 3Pt, 9-13 FT), 17 rebounds, three steals and two assists across 39 minutes in Saturday’s 111-79 loss to Dallas.","Antetokounmpo scored an in-efficient 24 points on Saturday, while hauling in 17 rebounds. He continues to put up massive numbers, even in blow-out losses. This was the first defeat since the acquisition of Eric Bledsoe, and barring this performance, the team have gelled well with their new point-guard. Antetokounmpo will get a chance to grab another victory on Monday against the Wizards.",11/18/2017 11:40:01 PM,203507,F,3,3456,MIL,bucks,270207,11/18/2017 11:40:01 PM,giannis_antetokounmpo
46,1511083807,Nerlens,Nerlens Noel: Plays only three minutes in victory,NO,Healthy,,,,,Noel,"Noel finished with just two points (1-2 FG), three rebounds and one assist in only three minutes during Saturday’s 111-79 victory over Milwaukee.","The fact that Noel was only able to see three minutes of action in a blow-out game, does not bode well for his future. He is currently well down the pecking order, playing behind Dirk Nowitzki, Dwight Powell and even Salah Mejri. The upside remains but until he can find some consistent minutes, he is barely a stash in deeper leagues.",11/18/2017 11:30:07 PM,203457,C,3,3431,DAL,mavericks,270206,11/18/2017 11:30:07 PM,nerlens_noel
47,1511083581,Wesley,Wesley Matthews: Scores 22 points in blow-out victory,NO,Healthy,,,,,Matthews,"Matthews tallied 22 points (8-14 FG, 6-8 3Pt), eight assists, two rebounds and two steals across 33 minutes in Saturday’s 111-79 victory over the Bucks.","Matthews was able to find his shot on Saturday, leading the Mavericks to an easy victory. As is the case every season, he has been inconsistent from the field, shooting at only 35 percent for the season. On nights like this, he demonstrates his upside, but these performances are few and far between. He remains more of a streaming option if you are in need of three-pointers.",11/18/2017 11:26:21 PM,202083,G,3,3057,DAL,mavericks,270205,11/18/2017 11:26:21 PM,wesley_matthews
48,1511083302,Ricky,Ricky Rubio: Scores only nine points in return,NO,Healthy,,,,,Rubio,"Rubio finished with just nine points (3-9 FG, 0-2 3Pt, 3-3 FT), six rebounds and three assists in 16 minutes during Saturday’s 125-85 victory over Orlando.","Rubio returned from a one-game absence due to a minor Achilles issue, and played just 16 minutes. This was due in part to the nature of the scoreline, and is probably not the best gauge of his health for owners. He has not been shooting the ball well over the last two weeks, and this continued against the Magic. Owners will be hoping he can turn it around when the Jazz face the surging Philadelphia 76ers on Monday.",11/18/2017 11:21:42 PM,201937,G,3,3012,UTA,jazz,270204,11/18/2017 11:21:42 PM,ricky_rubio
49,1511083021,Derrick,Derrick Favors: Double-doubles in easy victory,NO,Healthy,,,,,Favors,"Favors collected 25 points (10-12 FG, 5-5 FT), 11 rebounds, three assists and two blocks in 24 minutes during Saturday’s 125-85 victory over the Magic.","Favors was excellent in the blow-out victory, scoring a season-high 25 points. He was highly efficient from both the field and the free-throw line, while adding a pair of blocks. He is locked in as the starting center until Rudy Gobert (knee) is able to return. He only saw 24 minutes of action today, but that was due to the nature of the score. Moving forward he should be receiving around 30 minutes per night, enough for him to be a must-own player.",11/18/2017 11:17:01 PM,202324,F,3,3107,UTA,jazz,270203,11/18/2017 11:17:01 PM,derrick_favors
50,1511082770,Nikola,Nikola Vucevic: Salvages line with defense,NO,Healthy,,,,,Vucevic,"Vucevic finished with just eight points (3-11 FG, 2-3 3Pt), three steals, two rebounds, two blocks and one assist in 23 minutes during Saturday’s 125-85 loss to the Jazz","The Magic were terrible in this one, with the game practically over at half-time. The starters played limited minutes, including Vucevic who saw only 23 minutes. He was able to help owners with three steals and two blocks, but did little else. Since his hot start to the season, he has come back to where we thought he might be heading into opening night. He still remains an excellent option for anyone at the center position.",11/18/2017 11:12:50 PM,202696,C,3,3212,ORL,magic,270202,11/18/2017 11:12:50 PM,nikola_vucevic
51,1511078072,Kyrie,Kyrie Irving: Scores 30 points in win over Atlanta,NO,Healthy,,,,,Irving,"Irving led the Celtics with 30 points (10-12 FG, 5-6 3PT, 5-5 FT), four rebounds and five assists in a 110-99 win over the Atlanta Hawks on Saturday.","Ironically, the 12 shots taken were his lowest total of the season, despite finishing with his second-highest scoring total of the year. The elite efficiency has to be encouraging too, as Irving was shooting under 40 percent from the field through the first few weeks of November prior to this blow-up. He's also hitting just 34 percent of his three's, as Irving is one of few elite players who could see his numbers rise once his jumper starts falling. The fact that he's leading this team with 18.4 shots and a usage rate of 29.1 furthers that point, as he'll continue to play a huge role in the absence of Gordon Hayward (ankle).",11/18/2017 9:54:32 PM,202681,G,3,3186,BOS,celtics,270201,11/18/2017 9:54:32 PM,kyrie_irving
52,1511077674,Jaylen,Jaylen Brown: Drops 27 in win over Atlanta,NO,Healthy,,,,,Brown,"Brown tallied 27 points (10-13 FG, 4-6 3PT, 3-7 FT) and four rebounds in a 110-99 victory over the Atlanta Hawks on Saturday.","Brown is scorching hot right now, as he is averaging over 20 points across his last four games. What's going to keep him an elite fantasy option going forward are his minutes, as he is averaging over 32 minutes per game. If there's one aspect that he could see an improvement in, it's his assists. Brown is averaging just 1.3 assists per game for the year, but his 21.3 usage rate and minutes should allow him to get above two the more he develops. The sky is the limit for this 21-year-old, as he's turning into one of the waiver wire pickups of the year.",11/18/2017 9:47:54 PM,1627759,F,3,3894,BOS,celtics,270200,11/18/2017 9:47:54 PM,jaylen_brown
53,1511077144,John,John Collins: Scores 18 in loss to Boston,NO,Healthy,,,,,Collins,"Collins amassed 18 points (7-8 FG, 4-4 FT) and seven rebounds in a 110-99 loss to the Boston Celtics on Saturday.","Collins continues to be one of the best rookies in the league, as this is his 10th game with at least 12 points. What might be more impressive is the fact that he's doing this damage in limited minutes, as he's playing just 20.1 minutes per game. That's a number that will surely rise as the season progresses, especially considering the Hawks are looking more like a rebuild rather than a contender.The per-48 minutes speak for themselves too, as he is averaging 24.2 points, 16.6 rebounds and 2,3 blocks per-48 minutes played.",11/18/2017 9:39:04 PM,,F,3,4159,ATL,hawks,270199,11/18/2017 9:39:04 PM,
54,1511076835,Dennis,Dennis Schroder: Provides 23 points and nine assists against Boston,NO,Healthy,,,,,Schroder,"Schroder collected 23 points (9-18 FG, 3-3 FT), two rebounds, nine assists and two steals in a 110-99 loss to the Boston Celtics on Saturday.","Schroder has been in a minor slump over the last two weeks, as this breakout is a fantastic sign against an elite Boston defense. Many fantasy owners were worried about their field goal percentage when they drafted Schroder, but the fact that he's shooting at a 45 percent clip has to make owners ecstatic. If he can continue to provide his 19.9 points, 6.8 assists and 1,2 steals per game averages with that sort of percentage, Schroder will surely reach top-40 value.",11/18/2017 9:33:55 PM,203471,G,3,3444,ATL,hawks,270198,11/18/2017 9:33:55 PM,dennis_schroder
55,1511076330,Clint,Clint Capela: Double-doubles in win over Memphis,NO,Healthy,,,,,Capela,"Capela totaled 17 points (7-11 FG), 13 rebounds and three blocks in a 104-82 win over the Memphis Grizzlies on Saturday.","This marks Capela's 11th double-double of the season, as he continues to provide fantasy owners with what they wanted when they drafted him. What's quietly been a nice surprise is his free-throw shooting, as Capela is setting a career-high with a 64 percent free-throw percentage. He's also providing nearly two blocks a game, as his value should only rise with Chris Paul back in the lineup.",11/18/2017 9:25:30 PM,203991,C,3,3587,HOU,rockets,270197,11/18/2017 9:25:30 PM,clint_capela
56,1511076026,James,James Harden: Drops 29 in win over Memphis,NO,Healthy,,,,,Harden,"Harden collected 29 points (9-20 FG, 6-12 3PT, 5-5 FT), five rebounds, seven assists and three steals in a 105-83 win over the Memphis Grizzlies on Saturday.","The fact that the 29 points tied for his second-lowest mark of the month shows just how dominant Harden is right now, as he's averaging 37.6 points per game in November. What's most encouraging about his last two games is the fact that he's doing this sort of damage with Chris Paul in the lineup, as it's clear Paul wont hurt Harden's value. To further solidify his dominance, Harden has hit 47-straight free-throws across his last four games.",11/18/2017 9:20:26 PM,201935,G,3,3018,HOU,rockets,270196,11/18/2017 9:20:26 PM,james_harden
57,1511075701,Chandler,Chandler Parsons: Scores 17 points in start,NO,Healthy,,,,,Parsons,"Parsons got a rare start on Saturday, as he tallied 17 points (7-9 FG) and two rebounds across 25 minutes in a 105-83 loss to the Houston Rockets.","Parsons has now played 25 minutes in back-to-back games, which are his two highest totals of the season. He appears to have found his shot too, combining to go 12-of-16 from the field in those two games. The direct correlation with this increase in minutes is the absence of Mike Conley, whose expected to miss at least two weeks due to an Achilles' injury. As long as Conley is out, Parsons should continue to start and see over 20 minutes per game.",11/18/2017 9:15:01 PM,202718,F,3,3223,MEM,grizzlies,270195,11/18/2017 9:15:01 PM,chandler_parsons
58,1511065632,Kemba,Kemba Walker: Scores 26 points Saturday,NO,Healthy,,,,,Walker,"Walker scored 26 points (8-17 FG, 6-9 3PT, 4-4 FT) to go along with two rebounds and six assists over 35 minutes in Saturday’s 102-87 win over the Clippers.","Off to a career-high pace of 23.4 points per game entering Saturday, Walker further padded his scoring numbers by sinking a season-high six three-pointers against the Clippers. In addition, the Charlotte guard surpassed the 20 point mark for the fifth consecutive game. This level of consistent scoring has led Walker to become the focal point of the Hornets' offense at this early stage of the season. Also, the return of Nicolas Batum has not affected Walker as the guard has scored 20, 47, and 26 points in the three games since Batum's return.",11/18/2017 6:27:12 PM,202689,G,3,3189,CHA,hornets,270194,11/18/2017 6:27:12 PM,kemba_walker
59,1511064721,Patrick,Patrick Beverley: Plans return for Monday,YES,GTD,Soreness,,Right,Knee,Beverley,"Beverley (knee) is targeting his return for Monday against the Knicks, according to league sources,
 Adrian Wojnarowski of EPSN.com reports.",Beverley sat out his fifth consecutive game Saturday due to a sore right knee.,11/18/2017 6:12:01 PM,201976,G,3,3072,LAC,clippers,270193,11/18/2017 6:12:01 PM,patrick_beverley
60,1511064246,Joel,Joel Embiid: Scores 21 points Saturday,NO,Healthy,,,,,Embiid,"Embiid scored 21 points (7-16 FG, 1-4 3PT, 6-8 FT) to go along with eight rebounds, three assists and one block over 33 minutes in Saturday’s 124-116 loss to Golden State.","Following up his stellar performance against the Lakers on Wednesday, Embiid turned in a solid performance, collecting at least 20 points for the ninth time this season. The center's Saturday stat line pales in comparison to his one of a kind stat line of 46 points, 15 rebounds, seven assists and seven blocks. However, Embiid is a consistent scorer (22.8 points) and rebounder (10.29 rebounds) who is on the verge of breaking out on any given night.",11/18/2017 6:04:06 PM,203954,C,3,3572,PHI,sixers,270192,11/18/2017 6:04:06 PM,joel_embiid
61,1511063175,Kevin,Kevin Durant: Scored 27 points Saturday,YES,Out,,,,,Durant,"Durant scored 27 points (11-20 FG, 1-6 3PT, 4-6 FT) to go along with four rebounds, three assists, two steals and two blocks over 32 minutes in Saturday’s 124-116 win over Philadelphia.","For the seventh consecutive game, Durant scored at least 21 points. In fact, the Golden State forward has only dipped below 20 points once in 15 games this season. Durant, averaging 24.0 points in his six games prior to Saturday, is as consistent of a scorer as they come.",11/18/2017 5:46:15 PM,201142,F,3,2811,GSW,warriors,270191,11/18/2017 5:46:15 PM,kevin_durant
62,1511062595,Ben,Ben Simmons: Collects tenth double-double,NO,Healthy,,,,,Simmons,"Simmons scored 23 points (11-15 FG, 1-2 FT) to go along with eight rebounds, 12 assists and one steal over 37 minutes in Saturday’s 124-116 loss to Golden State.","Collecting his tenth double-double in his 15th career game, Simmons did the majority of his damage to the Warriors' defense in the first half. Early on in the contest, the guard drove to the hoop at will. However, he was kept largely at bay for most of the second half from an offensive perspective, scoring 8 of his 23 points. In addition, Simmons turned in a dynamic, overall performance, collecting a career-high 12 assists.",11/18/2017 5:36:35 PM,1627732,G,3,3849,PHI,sixers,270190,11/18/2017 5:36:35 PM,ben_simmons
63,1511062166,Stephen,Stephen Curry: Scores 35 points in win,NO,Healthy,,,,,Curry,"Curry scored 35 points (11-22 FG, 4-10 3PT, 9-9 FT) to go along with five rebounds, five assists and one block over 34 minutes in Saturday’s 124-116 win over Philadelphia.","Initially, Curry struggled mightily with his shot, going 5-of-14 from the floor and 0-of-4 from three-point range for a total of 15 points in the first half. However, the Golden State guard made six out of his next seven shots to run his point total up to 35 by the end of the third quarter. Curry's resiliency was the key factor in turning around what was shaping up to an uncharacteristically poor three-point shooting night, making 4-of-6 three-pointers in the second half.",11/18/2017 5:29:26 PM,201939,G,3,3014,GSW,warriors,270189,11/18/2017 5:29:26 PM,stephen_curry
64,1511061805,Robert,Robert Covington: Sinks five three-pointers in loss,NO,Healthy,,,,,Covington,"Covington scored 20 points (6-14 FG, 5-12 3PT, 3-3 FT) to go along with seven rebounds, one assist, two steals and one block over 36 minutes in Saturday’s 124-116 loss to Golden State.","Covington's four three-pointers in the first quarter kickstarted Philadelphia's 74 point first half. The forward, who shot 49.5 percent from beyond the arc entering Saturday, has drastically improved from his 33.3 percent average from 2016-17. However, Covington's early long range success did not carry over against Golden State, making 1-of-8 attempts after the first quarter. However, Covington has long term, added value as a legitimate, long range shooting threat.",11/18/2017 5:23:25 PM,203496,F,3,3495,PHI,sixers,270188,11/18/2017 5:23:25 PM,robert_covington
65,1511061305,Blake,Blake Griffin: Struggled from the floor in loss,NO,Healthy,,,,,Griffin,"Griffin scored 19 points (6-17 FG, 2-5 3PT, 5-7 FT) to go along with eight rebounds, four assists and one block over 35 minutes in Saturday’s 102-87 loss to Charlotte.","Once again, Griffin struggled from the floor, hitting 35.2 percent from the floor on Saturday. This marks the fifth time in the last six games in which the forward shot 35 percent or below. Through 15 games, Griffin is shooting a career-low 42.3 percent. Griffin will look to turn his shooting woes against New York on Monday.",11/18/2017 5:15:05 PM,201933,F,3,3016,LAC,clippers,270187,11/18/2017 5:15:05 PM,blake_griffin
66,1511060895,DeAndre,DeAndre Jordan: Collects eighth double-double,NO,Healthy,,,,,Jordan,"Jordan scored 10 points (4-5 FG, 2-2 FT) to go along with 14 rebounds, two assists and two blocks over 33 minutes in Saturday’s 102-87 loss to Charlotte.","One night removed from a 20 point, 22 rebound performance, Jordan turned in another strong rebounding performance against Charlotte. For the Clippers center, a double-digit rebound night has become the routine this season, tallying 12 games of at least 10 rebounds this season. Collecting his eighth double-double, Jordan is a remarkably consistent performer on the boards. Rebounds will always supplement his lack of high-scoring prowess.",11/18/2017 5:08:15 PM,201599,C,3,2929,LAC,clippers,270186,11/18/2017 5:08:15 PM,deandre_jordan
67,1511060588,Lou,Lou Williams: Scores team-high 25 points,NO,Healthy,,,,,Williams,"Williams scored 25 points (10-17 FG, 2-6 3PT, 3-6 FT) to go along with two rebounds and four assists over 29 minutes in Saturday’s 102-87 loss to Charlotte.","The veteran point guard has been a breath of fresh air from the bench for the Clippers. Including Saturday night's action, Williams has scored at least 20 points in three of his last five games. Outside of Blake Griffin, he has been the driving force behind the Clippers' offense, averaging 17.2 points entering Saturday. With little to no offense surrounding Williams and Griffin, expect Williams to play a substantial role going forward.",11/18/2017 5:03:08 PM,101150,G,3,2633,LAC,clippers,270185,11/18/2017 5:03:08 PM,louis_williams
68,1511058901,Brandan,"Brandan Wright: Injures groin, done for night",YES,Out,Not Specified,,Right,Groin,Wright,Wright injured his right groin and will not return to Saturday’s game against the Rockets.,McGee was removed in the second quarter after going scoreless in nearly seven minutes. He's considered day-to-day heading into Monday's game against the Trail Blazers.,11/18/2017 4:35:01 PM,201148,C,3,2815,MEM,grizzlies,270184,11/18/2017 4:35:01 PM,brandan_wright
69,1511058297,Jeremy,"Jeremy Lamb: Suffers hamstring injury, won't return",YES,GTD,Not Specified,,Right,Hamstring,Lamb,"Lamb injured his right hamstring and will not return to Saturday’s game against the Clippers, Stephanie Ready of Fox Sports Southeast reports.",It didn't take long for the Hornets to announce Lamb would not return. Consider him day-to-day heading into Monday's game against the Timberwolves.,11/18/2017 4:24:57 PM,203087,G,3,3319,CHA,hornets,270183,11/18/2017 4:24:57 PM,jeremy_lamb
70,1511057255,Ed,Ed Davis: Will play Saturday vs. Kings,NO,Healthy,,,,,Davis,"Davis (ankle) says he will play against the Kings, Mike Richman of The Oregonian reports.",Davis injured his ankle in Friday's first matchup with the Kings but he'll power through the pain and take the court again for the Saturday night rematch. Zach Collins -- who is only averaging seven minutes a contest -- could see an uptick in minutes if the Blazers choose to strictly monitor Davis's minutes in order to prevent further issues.,11/18/2017 4:07:35 PM,202334,F,3,3111,POR,blazers,270182,11/18/2017 4:07:35 PM,ed_davis
71,1511053399,Mario,Mario Hezonja: Probable to return Saturday,NO,Healthy,,,,Head,Hezonja,Hezonja suffered a head laceration but is probable to return Saturday against the Jazz.,"Hezonja didn't record any points prior to suffering the injury. He's played more than 10 minutes just once this season, so his absence shouldn't alter the Magic's rotation much.",11/18/2017 3:03:19 PM,1626209,G,3,3578,ORL,magic,270181,11/18/2017 3:03:19 PM,mario_hezonja
