,Date,FirstName,Headline,Injured,Injured_Status,Injury_Detail,Injury_Location,Injury_Side,Injury_Type,LastName,ListItemCaption,ListItemDescription,ListItemPubDate,PlayerID,Position,Priority,RotoId,Team,TeamCode,UpdateId,lastUpdate,player_code
76 ,1511465412,Georgios    ,Georgios Papagiannis: Doesn't play Wednesday                      ,NO     ,Healthy       ,             ,               ,             ,           ,Papagiannis     ,Papagiannis (abdomen) was expected to be available Wednesday against the Lakers but did not see the floor.                                                                                                                  ,"The Kings didn't offer much clarity, but Papagiannis appeared to be a DNP-CD, as has frequently been the case this season. The second-year big man had been battling a minor abdominal issue of late, but he's only appeared in four games on the season, totaling 26 minutes of mostly garbage-time play."                                                                                                                                                                                                                                                                                                                                                                                                                                                                           ,11/23/2017 9:30:12 AM ,1627834 ,C       ,3       ,3927  ,SAC ,kings       ,270570  ,11/23/2017 9:30:12 AM ,george_papagiannis
77 ,1511465175,Klay        ,Klay Thompson: Struggles with shot in loss                        ,NO     ,Healthy       ,             ,               ,             ,           ,Thompson        ,"Thompson mustered just nine points (3-12 FG, 3-8 3Pt), four rebounds, two assists and one block across 28 minutes in Wednesday’s 108-91 loss to the Thunder."                                                              ,"Thompson had a difficult time finding the basket, netting all nine of his points from long distance and going 0-for-4 from in front of the arc. It was the 27-year-old guard's second sub-30 percent shooting night in the last four contests and lowest scoring total of the season overall. Thompson has tallied under 20 points in four of the last five games overall, and despite a career-best 48.6 percent success rate from the field thus far, his scoring average has seen a near three-point drop from last season's 22.3 to 19.5."                                                                                                                                                                                                                                        ,11/23/2017 9:26:15 AM ,202691  ,G       ,3       ,3197  ,GSW ,warriors    ,270569  ,11/23/2017 9:26:15 AM ,klay_thompson
78 ,1511464874,Kevin       ,Kevin Durant: Totals 21 in return to action                       ,YES    ,Out           ,             ,               ,             ,           ,Durant          ,"Durant (ankle) provided 21 points (8-17 FG, 3-5 3Pt, 2-2 FT), five rebounds and two assists across 33 minutes in Wednesday’s 108-91 loss to the Thunder."                                                                  ,"Durant was able to return without limitations after a one-game absence due to an ankle injury and was effective while dueling with many of his former teammates. The All-Star forward has scored under 20 points only once all season and has been shooting particularly well in November, as evidenced by a 52.6 percent success rate across eight contests this month."                                                                                                                                                                                                                                                                                                                                                                                                             ,11/23/2017 9:21:14 AM ,201142  ,F       ,3       ,2811  ,GSW ,warriors    ,270568  ,11/23/2017 9:21:14 AM ,kevin_durant
79 ,1511464702,Stephen     ,Stephen Curry: Pours in 24 in double-digit loss                   ,NO     ,Healthy       ,             ,               ,             ,           ,Curry           ,"Curry tallied 24 points (9-18 FG, 3-8 3Pt, 3-3 FT), six assists, five rebounds and one steal across 31 minutes in Wednesday’s 108-91 loss to the Thunder."                                                                 ,"Curry saw slightly less playing time than usual with the game essentially decided midway through the fourth quarter, but he was able maintain the hot hand he'd flashed in the prior two contests. The perennial All-Star shot at least 50.0 percent for the third consecutive game and also extended his season-opening streak of multiple threes to 17 games. Curry will look to help the Warriors quickly put the rare double-digit defeat behind them when they tangle with the Bulls on Friday night."                                                                                                                                                                                                                                                                           ,11/23/2017 9:18:22 AM ,201939  ,G       ,3       ,3014  ,GSW ,warriors    ,270567  ,11/23/2017 9:18:22 AM ,stephen_curry
80 ,1511464154,Willie      ,Willie Cauley-Stein: Leads team with 26 points                    ,NO     ,Healthy       ,             ,               ,             ,           ,Cauley-Stein    ,"Cauley-Stein tallied 26 points (10-14 FG, 0-1 3Pt, 6-8 FT), six rebounds, two assists and one steal across 28 minutes in Wednesday’s 113-102 win over the Lakers"                                                          ,"A recent demotion to the bench appears to have motivated Cauley-Stein. As a result, he's strung together some decent stat lines in his new role, which is most likely a temporary move for the team.  Cauley-Stein's fantasy viability at center is directly tied to how bad the Kings have been playing, despite this recent series of wins.  He ranks 21st in scoring average among centers, where he sits alongside many second-unit big men, so this move to the bench might be the appropriate move going forward."                                                                                                                                                                                                                                                              ,11/23/2017 9:09:14 AM ,1626161 ,C       ,3       ,3740  ,SAC ,kings       ,270566  ,11/23/2017 9:09:14 AM ,willie_cauley-stein
81 ,1511463889,Al          ,Al Horford: Scores 27 points in loss to Heat                      ,NO     ,Healthy       ,             ,               ,             ,           ,Horford         ,"Horford scored 27 points (11-14 FG, 4-5 3Pt, 2-2 FT), grabbed nine rebounds, dished four assists, and recorded one block in 34 minutes Thursday in Boston’s win over Milwaukee."                                           ,"Horford is flourishing in his second season under coach Brad Stevens. His offensive production will vary from night to night considering the variety of offensive talent on the Celtics' roster, but that isn't to say he doesn't have the green light when he has the ball in his hands. Horford can affect the game in a multitude of ways on both ends of the floor and always keeps the ball moving, which opens the floor for his teammates."                                                                                                                                                                                                                                                                                                                                    ,11/23/2017 9:04:49 AM ,201143  ,C       ,3       ,2816  ,BOS ,celtics     ,270565  ,11/23/2017 9:04:49 AM ,al_horford
82 ,1511463835,Goran       ,Goran Dragic: Scores 27 points in 31 minutes                      ,NO     ,Healthy       ,             ,               ,             ,           ,Dragic          ,"Dragic accounted for 26 points (8-17 FG, 2-4 3Pt, 9-10 FT), grabbed five rebounds, collected four assists and one steal across 36 minutes Wednesday in Miami’s win over Boston."                                           ,"Dragic was a driving force behind Miami's victory Wednesday night over Boston. Along with starting shooting guard Dion Waiters, the backcourt tandem accounted for most of Miami's production, combining for 53 points and 10 assists. Dragic was running the point and attacking the paint tirelessly, consistently finding himself at the free-throw line where connected on nine of 10 attempts. During their time together in Miami, Dragic and Waiters have shared ball-handling duties and will continue to do so. There will be no shortage of opportunities, and Dragic will continue to take advantage of them."                                                                                                                                                             ,11/23/2017 9:03:55 AM ,201609  ,G       ,3       ,2955  ,MIA ,heat        ,270564  ,11/23/2017 9:03:55 AM ,goran_dragic
83 ,1511463788,Dion        ,Dion Waiters: Scores 26 points as Heat end Celtics' streak        ,NO     ,Healthy       ,             ,               ,             ,           ,Waiters         ,"Waiters poured in 26 points (11-24 FG, 4-10 3Pt), grabbed two rebounds, and collected six assists, in 36 minutes Wednesday in Miami’s win over Boston."                                                                    ,"The Heat were able to bring Boston's winning streak to a screeching halt Wednesday in Miami behind the scoring of their backcourt tandem. Waiters and starting point guard Goran Dragic accounted for most of Miami's production, combining for 53 points and 10 assists. Waiters took a team-high 24 shots, including 10 from beyond the arc, but that shouldn't come as a surprise to anybody who has followed his career. He is a volume scorer in its purest form, and coach Erik Spoelstra will continue to put him in a position to succeed."                                                                                                                                                                                                                                   ,11/23/2017 9:03:08 AM ,203079  ,G       ,3       ,3315  ,MIA ,heat        ,270563  ,11/23/2017 9:03:08 AM ,dion_waiters
84 ,1511463697,Kyrie       ,Kyrie Irving: Scores 23 points in 33 minutes                      ,NO     ,Healthy       ,             ,               ,             ,           ,Irving          ,"Irving accumulated 23 points (11-22 FG, 0-3 3Pt, 1-4 FT), one rebound, three assists, and three steals along with one steal in 33 minutes Wednesday as Boston fell to Miami."                                              ,"With this loss to Miami, Boston's winning streak came to an end. Irving failed to connect from deep for only the third time this season and had his lowest assist total since Boston's last matchup with the Heat. Overall, it was a down night for the offense as a whole. As a team, Boston shot 41.7-percent from the field, and only connected on 70-percent of their free-throw attempts. Look for Irving and the Celtics to get back into rhythm on Friday when Orlando comes to town."                                                                                                                                                                                                                                                                                         ,11/23/2017 9:01:37 AM ,202681  ,G       ,3       ,3186  ,BOS ,celtics     ,270562  ,11/23/2017 9:01:37 AM ,kyrie_irving
85 ,1511463662,Jayson      ,Jayson Tatum: Scores 18 points in loss to Miami                   ,NO     ,Healthy       ,             ,               ,             ,           ,Tatum           ,"Tatum scored 18 points (5-11 FG, 3-4 3Pt, 5-5 FT), grabbed seven rebounds, dished four assists, and recorded one block and one steal in 34 minutes Wednesday as Boston fell to Miami."                                     ,"Tatum has managed to affect games in multiple ways on a nightly basis throughout his rookie season. Through 19 games, Tatum leads the Celtics with a true-shooting percentage of 63.2%. On a team flush with options on offense Tatum won't be the primary focus. However, he has proven he can score efficiently at an NBA level and will continue to improve and provide fantasy value as he acclimates to coach Brad Stevens' system and the general pace-of-play of the league."                                                                                                                                                                                                                                                                                                  ,11/23/2017 9:01:02 AM ,        ,F       ,3       ,4108  ,BOS ,celtics     ,270561  ,11/23/2017 9:01:02 AM ,
86 ,1511463195,Bobby       ,"Bobby Portis: Scores 14, grabs eight boards in loss"             ,NO     ,Healthy       ,             ,               ,             ,           ,Portis          ,"Portis recorded 14 points (5-11 FG, 0-3 3Pt, 4-4 FT),  eight rebounds, two assists and a blocked shot across 25 minutes in Wednesday’s 110-80 loss to the Jazz."                                                           ,"Portis was one of the lone bright spots for the Bulls on Wednesday as the Jazz effectively shut down Chicago's backcourt.  Portis might have seen more time due to Lauri Markannen's struggles on the court but he accumulated five fouls and logged only 25 minutes.  Portis has played serviceably since his return from injury, but Markannen has pushed him out of the starting five indefinitely. It's hard to justify a spot for Portis on your roster due to his current usage."                                                                                                                                                                                                                                                                                               ,11/23/2017 8:53:15 AM ,1626171 ,F       ,3       ,3705  ,CHI ,bulls       ,270560  ,11/23/2017 8:53:15 AM ,bobby_portis
87 ,1511463171,Nicolas     ,Nicolas Batum: Questionable vs. Cleveland                         ,YES    ,Out           ,Bruise       ,               ,Left         ,Elbow      ,Batum           ,"Batum (elbow) is questionable for Friday’s game against the Cavaliers, Rick Bonnell of The Charlotte Observer reports."                                                                                                    ,"Batum suffered a bruised left elbow in Wednesday's overtime win over the Wizards and did not return. There seems to be some optimism surrounding Batum's questionable tag, but given that it is the same elbow that kept Batum out for several weeks to start the season, it's possible the team chooses to exercise caution. Expect another update on the Frenchman following the Hornets' morning shootaround."                                                                                                                                                                                                                                                                                                                                                                     ,11/23/2017 8:52:51 AM ,201587  ,F       ,3       ,2821  ,CHA ,hornets     ,270559  ,11/23/2017 8:52:51 AM ,nicolas_batum
88 ,1511462332,Robin       ,Robin Lopez: Leads team with 15 points in loss                    ,NO     ,Healthy       ,             ,               ,             ,           ,Lopez           ,"Lopez posted 15 points (6-9 FG, 3-4 FT), four rebounds and an assist across 25 minutes in Wednesday’s 110-80 loss to the Jazz."                                                                                            ,"With Chicago's backcourt mostly stifled by the Jazz, most of the Bulls' output was found inside with Lopez pacing the team.  Lopez and Bobby Portis were the only bright spots to speak of under the basket, as Luis Markkanen had a horrible outing and Denzel Valentine was even less effective. The nine-year veteran brings much-needed experience and leadership to this young team and despite their recent woes, Lopez has shown decent production, averaging 13.4 points and 5.4 rebounds over the first 16 games of the season."                                                                                                                                                                                                                                             ,11/23/2017 8:38:52 AM ,201577  ,C       ,3       ,2919  ,CHI ,bulls       ,270558  ,11/23/2017 8:38:52 AM ,robin_lopez
89 ,1511461229,Rodney      ,Rodney Hood: Pours in 19 points off the bench                     ,NO     ,Healthy       ,             ,               ,             ,           ,Hood            ,"Hood scored 19 points (7-17 FG, 3-9 3Pt, 2-2 FT) while adding four rebounds, an assist and a steal across 25 minutes in Wednesday’s 110-80 win over the Bulls."                                                            ,"With rookie Donovan Mitchell struggling with his shot, Hood entered the game and saw extensive time on the floor as part of Utah's blistering perimeter attack, which was firing on all cylinders Wednesday. Hood's fantasy value has been complicated by a combination of new teammate Ricky Rubio and the excellent play of Mitchell. Hood saw one start last week when Mitchell shifted to the point but it appears that a Rubio/Mitchell backcourt will be the new normal, leaving Hood to provide less fantasy value with the second unit.  Hood will have to string together similar stat lines and more usage to be completely reliable in any format, but he's still widely owned. He should warrant some consideration, especially if Mitchell's shot continues to fail him.",11/23/2017 8:20:29 AM ,203918  ,G       ,3       ,3591  ,UTA ,jazz        ,270557  ,11/23/2017 8:20:29 AM ,rodney_hood
90 ,1511460526,Derrick     ,Derrick Favors: Leads team with 23 points in rout                 ,NO     ,Healthy       ,             ,               ,             ,           ,Favors          ,"Favors recorded 23 points (8-11 FG, 7-8 FT), seven rebounds, an assist, a steal and a blocked shot across 29 minutes in Wednesday’s 110-80 win over the Bulls."                                                            ,"As the primary replacement for Rudy Gobert (knee), Favors has emerged as an attractive fantasy option off the waiver wire.  He's executing effectively on both sides of the ball and is averaging 15.9 points, 9.1 rebounds and 1.6 blocks across seven games since Gobert's injury.  With no clear timetable for Gobert's return, Favors becomes a must-add target and a rosterable player for at least the next month."                                                                                                                                                                                                                                                                                                                                                             ,11/23/2017 8:08:46 AM ,202324  ,F       ,3       ,3107  ,UTA ,jazz        ,270556  ,11/23/2017 8:08:46 AM ,derrick_favors
91 ,1511445665,Rudy        ,Rudy Gay: Scores team-high 19 points                              ,NO     ,Healthy       ,             ,               ,             ,           ,Gay             ,"Gay scored 19 points (8-14 FG, 2-3 3PT, 1-1 FT) to go along with three rebounds, two assists and one steal across 25 minutes in Wednesday’s 107-90 loss to New Orleans."                                                   ,"With 19 points from the bench on Wednesday, Gay led San Antonio in scoring on a night when the offense struggled to reach 90 points. The forward was also efficient from the floor, hitting 57.1 percent of his shots as well as 2-of-3 from beyond the arc. Wednesday's scoring performance aside, do not expect Gay to lead the Spurs offense on a nightly basis. Gay will look to chip in more from the bench on Saturday against Charlotte."                                                                                                                                                                                                                                                                                                                                      ,11/23/2017 4:01:05 AM ,200752  ,F       ,3       ,2691  ,SAS ,spurs       ,270555  ,11/23/2017 4:01:05 AM ,rudy_gay
92 ,1511444764,LaMarcus    ,LaMarcus Aldridge: Scores 16 points in loss                       ,NO     ,Healthy       ,             ,               ,             ,           ,Aldridge        ,"Aldridge scored 16 points (7-14 FG, 0-1 3PT, 2-2 FT) to go along with four rebounds and one assist across 27 minutes in Wednesday’s 107-90 loss to New Orleans."                                                           ,"Much like the San Antonio offense, Aldridge was rather quiet against New Orleans. Aldridge, who is averaging 21.9 points, is very much off to a solid start as the focal point of the San Antonio offense in the absence of Tony Parker (quadriceps) and Kawhi Leonard (quadriceps). The power forward will look to bounce back Saturday against a middling Charlotte defense that gives up an average of 106.5 points per game."                                                                                                                                                                                                                                                                                                                                                     ,11/23/2017 3:46:04 AM ,200746  ,F       ,3       ,2502  ,SAS ,spurs       ,270554  ,11/23/2017 3:46:04 AM ,lamarcus_aldridge
93 ,1511437525,James       ,James Harden: Has quiet game in easy victory                      ,NO     ,Healthy       ,             ,               ,             ,           ,Harden          ,"Harden tallied 21 points (6-16 FG, 1-7 3Pt, 8-9 FT), nine assists and eight rebounds in 31 minutes during Wednesday’s 125-95 victory over the Nuggets."                                                                    ,"Harden cooled off, scoring his lowest point total of the month. The fact that a line like this is deemed a quiet night, speaks volumes about how good he has been this season. He appears to be fitting in well next to Chris Paul, who continues to ramp up his playing time. There is no reason to believe Harden cannot put up numbers similar to last season, apart from taking a hit to his assists total. He should remain a top-five fantasy asset, barring any injury setbacks."                                                                                                                                                                                                                                                                                              ,11/23/2017 1:45:25 AM ,201935  ,G       ,3       ,3018  ,HOU ,rockets     ,270553  ,11/23/2017 1:45:25 AM ,james_harden
94 ,1511437184,Chris       ,Chris Paul: Double-doubles in victory                             ,NO     ,Healthy       ,             ,               ,             ,           ,Paul            ,"Paul finished with 23 points (8-11 FG, 4-7 3Pt, 3-4 FT), 12 assists, three steals and two rebounds across 27 minutes in Wednesday’s 125-95 victory over Denver."                                                           ,"Paul had his best game in a Rockets jersey, collecting season-high totals in points, assists, and steals. He has his shot going tonight, albeit against a lackluster Dever defense. He played right on his minutes restriction of 28 minutes, and this is a great sign for owners given the nature of the scoreline. He should be locked in for 30 minutes plus moving forward, and should now be deployed in all formats."                                                                                                                                                                                                                                                                                                                                                           ,11/23/2017 1:39:44 AM ,101108  ,G       ,3       ,2584  ,HOU ,rockets     ,270552  ,11/23/2017 1:39:44 AM ,chris_paul
