,Date,FirstName,Headline,Injured,Injured_Status,Injury_Detail,Injury_Location,Injury_Side,Injury_Type,LastName,ListItemCaption,ListItemDescription,ListItemPubDate,PlayerID,Position,Priority,RotoId,Team,TeamCode,UpdateId,lastUpdate,player_code
114,1511021704,Emmanuel,Emmanuel Mudiay: Scores 19 off bench Friday,NO,Healthy,,,,,Mudiay,"Mudiay scored 19 points (7-11 FG, 3-6 3Pt, 2-2 FT) while adding six assists, two rebounds and a steal in 23 minutes off the bench during Friday’s 146-114 win over the Pelicans.","While Jamal Murray has a starting spot in the Nuggets' backcourt locked down, Mudiay is showing some improvement as well, averaging 14.0 points, 3.5 assists, 3.3 boards and 2.0 three-pointers over his last four games. The 21-year-old will have a hard time putting together a breakout campaign, even in a sixth-man role, without more consistent court time, however.",11/18/2017 6:15:04 AM,1626144,G,3,3684,DEN,nuggets,270137,11/18/2017 6:15:04 AM,emmanuel_mudiay
115,1511021615,Mike,Mike Muscala: Cleared to play Saturday,YES,GTD,Not Specified,,Not Specified,,Muscala,"Muscala (ankle) will be available for Saturday’s game against the Celtics, Michael Cunningham of the Atlanta Journal-Constitution reports.","Muscala has missed the team's past six games while nursing an ankle injury. He was averaging 22.4 minutes per game prior to the injury, though that was with other Hawks frontcourt players (such as Ersan Ilyasova) being out with injury. So, while Muscala will return Saturday, he may play less than before.",11/18/2017 6:13:35 AM,203488,C,3,3463,ATL,hawks,270136,11/18/2017 6:13:35 AM,mike_muscala
116,1511020363,Nikola,Nikola Jokic: Double-double in Friday's rout,NO,Healthy,,,,,Jokic,"Jokic scored 13 points (3-5 FG, 1-2 3Pt, 6-6 FT) while adding 11 rebounds, six assists and a block in 27 minutes during Friday’s 146-114 win over the Pelicans.","His biggest contribution on the night didn't show up on the scoresheet, however, as an accidental collision with Anthony Davis early in the third quarter sent the Pelicans' big man to the locker room with a concussion and opened the floodgates on the rout. Jokic now has eight double-doubles in 15 games on the season, and while Jamal Murray is increasingly becoming the focus of the Nuggets' offense, the team's 22-year-old center appears headed for a career year of his own.",11/18/2017 5:52:43 AM,203999,C,3,3612,DEN,nuggets,270135,11/18/2017 5:52:43 AM,nikola_jokic
117,1511020276,Josh,Josh McRoberts: Will remain out Saturday,YES,Out,Not Specified,,Not Specified,Lower Body,McRoberts,"McRoberts (lower body) will be sidelined for Saturday’s game against the Bucks, Earl K. Sneed of the Mavericks’ official site reports.","There's no indication McRoberts, who has missed every game this season, is close to returning. Until further notice, he'll likely continue to be re-evaluated on a day-to-day basis.",11/18/2017 5:51:16 AM,201177,F,3,2832,DAL,mavericks,270134,11/18/2017 5:51:16 AM,josh_mcroberts
118,1511020227,Seth,Seth Curry: Will remain sidelined Saturday,YES,Out,Fracture,,Left,Lower Leg,Curry,"Curry (lower leg) will not make his season debut Saturday against the Mavericks, Earl K. Sneed of the Mavericks’ official site reports.","The Mavericks have never offered a clear timetable for Curry's recovery from a stress reaction in his lower leg. Thus, his status will need to continue to be monitored on a game-to-game basis. In the meantime, Dennis Smith and Yogi Ferrell figure to continue getting the majority of the work in the Mavericks' backcourt.",11/18/2017 5:50:27 AM,203552,G,3,3498,DAL,mavericks,270133,11/18/2017 5:50:27 AM,seth_curry
119,1511020171,Paul,Paul Millsap: Scores 20 in Friday's rout,NO,Healthy,,,,,Millsap,"Millsap scored 20 points (8-14 FG, 3-6 3Pt, 1-3 FT) while adding seven assists, six rebounds, two steals and two blocks in only 27 minutes during Friday’s 146-114 win over the Pelicans.","What little resistance the New Orleans defense was putting up in the first half evaporated after Anthony Davis left the court with a concussion in the third quarter, allowing Denver to shoot better than 60 percent from the floor and 50 percent from beyond the arc on the night. It's the first time in six games that Millsap has scored 20 or more points, and his current 69.2 percent mark from the free-throw line would be his worst performance in that category in a decade, but the veteran forward's ability to chip in all over the scoresheet is keeping his fantasy value afloat.",11/18/2017 5:49:31 AM,200794,F,3,2705,DEN,nuggets,270132,11/18/2017 5:49:31 AM,paul_millsap
120,1511019885,Wilson,Wilson Chandler: Double-double in Friday's blowout win,NO,Healthy,,,,,Chandler,"Chandler scored 15 points (5-8 FG, 2-5 3Pt, 3-5 FT) while adding 11 rebounds and four assists in 36 minutes during Friday’s 146-114 win over the Pelicans.","New Orleans' defense was merely shaky in the first half but completely collapsed early in the third quarter after Anthony Davis left with a concussion, allowing every Denver starter to either rack up a double-double or score 20-plus points. After a slow start to the campaign Chandler has begun putting up his usual numbers again, averaging 14.0 points, 6.7 boards, 4.0 assists and 1.0 three-pointers over his last three games.",11/18/2017 5:44:45 AM,201163,F,3,2880,DEN,nuggets,270131,11/18/2017 5:44:45 AM,wilson_chandler
121,1511019674,Gary,Gary Harris: Drops season-high 22 in Friday's return,NO,Healthy,,,,,Harris,"Harris scored 22 points (9-11 FG, 4-6 3Pt) while adding five assists and three rebounds in 31 minutes during Friday’s 146-114 win over the Pelicans.","The Nuggets could do almost nothing wrong on offense in this one, particularly once Anthony Davis left the game early in the second half with a concussion, so Harris enjoyed a very strong return after missing two games due to a shoulder issue. The 23-year-old is averaging a career-high 2.3 three-pointers per game so far, and he's quietly forming a very intriguing backcourt in Denver alongside emerging star Jamal Murray.",11/18/2017 5:41:14 AM,203914,G,3,3582,DEN,nuggets,270130,11/18/2017 5:41:14 AM,gary_harris
122,1511019448,Jamal,Jamal Murray: Explodes for 31 in Friday's win,NO,Healthy,,,,,Murray,"Murray scored 31 points (13-18 FG, 3-7 3Pt, 2-2 FT) while adding four assists and two rebounds in 34 minutes during Friday’s 146-114 win over the Pelicans.","The 20-year-old led the way for Denver as they set a new NBA season high for points in a regulation game, while the the last time the Nuggets scored more points than this in franchise history, it came in a clash against the SuperSonics (!). Murray's now topped 30 points in two of his last three games, and while his production is likely to remain somewhat inconsistent going forward, he appears to be settling into his new role as the team's primary scoring option.",11/18/2017 5:37:28 AM,1627750,G,3,3882,DEN,nuggets,270129,11/18/2017 5:37:28 AM,jamal_murray
123,1511019073,Jameer,Jameer Nelson: Just misses double-double Friday,NO,Healthy,,,,,Nelson,"Nelson scored 10 points (4-6 FG, 2-4 3Pt) while adding nine assists and four rebounds in 28 minutes off the bench during Friday’s 146-114 loss to the Nuggets.","The Pelicans' backcourt rotation has shifted around this week with Rajon Rondo finally healthy enough to join the mix, but Nelson's role as the court general for the second unit appears to be unaffected. The veteran point guard is still capable of the occasional useful game, but his overall fantasy contributions will likely remain inconsistent.",11/18/2017 5:31:13 AM,2749,G,3,2493,NOP,pelicans,270128,11/18/2017 5:31:13 AM,jameer_nelson
124,1511018865,E'Twaun,E'Twaun Moore: Scores 16 off bench Friday,NO,Healthy,,,,,Moore,"Moore scored 16 points (7-11 FG, 2-3 3Pt) while adding three assists, two rebounds and a steal in 27 minutes off the bench during Friday’s 146-114 loss to the Nuggets.","The 28-year-old has stayed productive since shifting to the bench two games ago to accommodate the return of Rajon Rondo, but without a consistent 30-plus minutes a night it could be hard for Moore to maintain his career-best scoring pace, even as the primary outside threat on the Pelicans' second unit.",11/18/2017 5:27:45 AM,202734,G,3,3227,NOP,pelicans,270127,11/18/2017 5:27:45 AM,etwaun_moore
125,1511018350,Russell,Russell Westbrook: Struggles with shot in loss,NO,Healthy,,,,,Westbrook,"Westbrook posted 15 points (5-22 FG, 0-4 3Pt, 5-5 FT), nine rebounds and nine assists across 38 minutes in Friday’s 104-101 loss to the Spurs","There may be no such thing as a 'poor' triple-double, but Westbrook came just shy of one Friday despite experiencing one of worst shooting nights this season. He shot a horrible 22.7 from the floor and failed to make a 3-pointer for only the fourth time this season.  It's hard to criticize the MVP, but the Thunder are blowing huge leads left and right and something needs to be done to fix the chemistry between their three All-Stars. Chemistry won't help if Westbrook has a cold shot, though. As usual, he's still a must-start despite his recent troubles.",11/18/2017 5:19:10 AM,201566,G,3,2932,OKC,thunder,270126,11/18/2017 5:19:10 AM,russell_westbrook
126,1511017960,Paul,Paul George: Goes for 18 points in loss,NO,Healthy,,,,,George,"George posted 18 points (5-16 FG, 3-6 3Pt, 5-8 FT), seven rebounds, six assists and three steals across 42 minutes in Friday’s 104-101 loss to the Spurs.","George sported the most balanced stat line of the starting five Friday, but the Thunder needs to figure out how to stop blowing huge leads like they had against the Spurs. One of the biggest keys to that is increased production from their three biggest stars.  Look for George to do his part Monday against the Pelicans.",11/18/2017 5:12:40 AM,202331,F,3,3114,OKC,thunder,270125,11/18/2017 5:12:40 AM,paul_george
127,1510996061,Reggie,Reggie Jackson: Continues resurgence in loss,NO,Healthy,,,,,Jackson,"Jackson recorded 16 points (7-14 FG, 2-5 3Pt), seven assists and two rebounds across 28 minutes in Friday’s 107-100 loss to the Pacers.","Jackson has had a good start to his campaign, bouncing back nicely after last years disaster of a season. He is finding his way to the basket as well as hitting his outside shots. His minutes are going to be capped at about 30 due to the fact that Ish Smith is also playing well off the bench. However, he appears to have the starting position locked up, and should be owned in all leagues.",11/17/2017 11:07:41 PM,202704,G,3,3217,DET,pistons,270124,11/17/2017 11:07:41 PM,reggie_jackson
128,1510995829,Andre,Andre Drummond: Impressive in loss,NO,Healthy,,,,,Drummond,"Drummond collected 11 points 5-10 FG, 1-2 FT), 15 rebounds, five assists, three blocks and one steal in 35 minutes during Friday’s 107-100 loss to Indiana.","Drummond dominated inside again on Friday, continuing his efforts to pull down every rebound that comes his way. This was a tough loss for the Pistons after leading by 22 points in the third quarter, however, Drummond stayed true with yet another double-double. As well as his boards, his steal and block numbers have been terrific to start the season, something quite sought after in a big man.",11/17/2017 11:03:49 PM,203083,C,3,3300,DET,pistons,270123,11/17/2017 11:03:49 PM,andre_drummond
129,1510995486,Domantas,Domantas Sabonis: Double-doubles in victory,NO,Healthy,,,,,Sabonis,"Sabonis tallied 12 points (4-11 FG, 0-1 3Pt, 4-4 FT), 10 rebounds and one steal in 24 minutes during Friday’s 107-100 victory over Detroit.","Sabonis was questionable coming into the game with an illness, however, he looked good in his 24 minutes on the floor. He actually finished the game over Myles Turner, providing plenty of energy during the comeback. Coach Nate McMillan has said that he wants to find minutes for Sabonis, as evidenced by his efforts tonight. If he was dropped in your league, he is worthy of a spot if you need points and boards at the end of your roster.",11/17/2017 10:58:06 PM,1627734,F,3,3865,IND,pacers,270122,11/17/2017 10:58:06 PM,domantas_sabonis
