,Date,FirstName,Headline,Injured,Injured_Status,Injury_Detail,Injury_Location,Injury_Side,Injury_Type,LastName,ListItemCaption,ListItemDescription,ListItemPubDate,PlayerID,Position,Priority,RotoId,Team,TeamCode,UpdateId,lastUpdate,player_code
66,1514492546,Gerald,Gerald Green: Set to sign with Rockets,NO,Healthy,,,,,Green,"Green is expected to finalize a one-year, non-guaranteed deal with the Rockets on Thursday, Jonathan Feigen of the Houston Chronicle reports.","The contract is not yet official, but all signs point to the veteran wing joining the Rockets sometime over the weekend. With Houston battling injuries to Troy Williams and Luke Richard Mbah a Moute, Green could grab hold of a small role off the bench, but he's unlikely to stick around long-term, especially given the non-guaranteed nature of the contract. The 18th pick in the 2005 Draft, Green has spent time with several NBA franchises over the course of his career, including a one-game stint with the Rockets in 2007-08. He spent last season in Boston, where he appeared in 47 games off the bench and posted averages of 5.6 points and 1.8 rebounds per game. Feigen reports that Green could be in uniform as early as Thursday night against Boston.",12/28/2017 10:22:26 AM,101123,G,3,2588,HOU,rockets,273952,12/28/2017 10:22:26 AM,gerald_green
67,1514489167,Justin,Justin Anderson: Will play Thursday vs. Trail Blazers,NO,Healthy,,,,,Anderson,"Anderson (lower leg) has been cleared to play in Thursday’s matchup with the Trail Blazers, Jessica Camerato of NBC Sports Philadelphia reports.","Anderson has been ramping up his activity of late after missing the last 19 games with shin splints and after testing everything out during morning shootaround, he's now officially been given the green light to play. That said, Anderson could have some restrictions considering he's fresh off an extended absence, so fantasy owners may want to avoid the situation for awhile yet. Prior to the injury, Anderson was seeing minutes in the upper teens at best, which kept his fantasy value low.",12/28/2017 9:26:07 AM,1626147,G,3,3718,PHI,sixers,273951,12/28/2017 9:26:07 AM,justin_anderson
68,1514488893,Joel,Joel Embiid: Questionable for Thursday,NO,Healthy,Soreness,,Not Specified,Back,Embiid,"Embiid (back) is questionable to play in Thursday’s game against the Trail Blazers, Keith Pompey of the Philadelphia Inquirer reports.","Embiid received treatment instead of going through morning shootaround Thursday, though coach Brett Brown said there were ""no red flags,"" so there doesn't appear to be a serious issue at hand. Still, considering how the Sixers like to be overly cautious with their star big man, there's a chance Embiid is held out, so continue to monitor his status up until tip-off. If Embiid is held out, Richaun Holmes would  become an intriguing DFS play, while Amir Johnson would pick up some extra minutes as well.",12/28/2017 9:21:33 AM,203954,C,1,3572,PHI,sixers,273950,12/28/2017 9:21:33 AM,joel_embiid
69,1514488365,Aaron,Aaron Brooks: Questionable for Thursday,NO,Healthy,,,,Illness,Brooks,"Brooks (illness) is questionable for Thursday’s game against the Bucks, Jace Frederick of the Pioneer Press reports.","Brooks will likely receive treatment throughout the day with the hope of feeling better by the end of pregame warmups, though we may not get final word on his availability until right before tip-off. Prior to the injury, Brooks had been outside the regular rotation, though Jeff Teague just went down with sprained knee and is out indefinitely, so Brooks would have the chance to get some run if he's ultimately cleared to play.",12/28/2017 9:12:45 AM,201166,G,3,2842,MIN,timberwolves,273949,12/28/2017 9:12:45 AM,aaron_brooks
70,1514488045,Dion,Dion Waiters: Out Friday vs. Nets,YES,Out,Sprain,,Left,Ankle,Waiters,"Waiters (ankle) is listed as out for Friday’s game against the Nets, Tim Reynolds of the Associated Press reports.","Waiters was unable to practice on Thursday, so it doesn't come as much of a surprise that he'll be out once again Friday. With the Heat going into a back-to-back set, there's certainly a chance he sits out Saturday's contest as well, though tentatively consider him questionable for that contest for the time being. Tyler Johnson will likely pick up a third straight start, with guys like Josh Richardson and Wayne Ellington seeing some extra minutes as well.",12/28/2017 9:07:25 AM,203079,G,3,3315,MIA,heat,273948,12/28/2017 9:07:25 AM,dion_waiters
71,1514487755,Justise,Justise Winslow: Will remain out Friday,YES,Out,Strain,,Left,Knee,Winslow,"Winslow (knee) is listed as out for Friday’s game against the Nets, Tom D’Angelo of the Palm Beach Post reports.","Winslow was able to go through a light practice Thursday, so it appears he could be trending towards returning at some point over the next few games. That won't come on Friday, however, as Winslow is going to remain sidelined for a eighth straight game. With James Johnson (ankle) also still out, Kelly Olynyk, Bam Adebayo and Jordan Mickey should all continue to see extra playing time in the frontcourt.",12/28/2017 9:02:35 AM,1626159,F,3,3719,MIA,heat,273947,12/28/2017 9:02:35 AM,justise_winslow
72,1514487516,James,James Johnson: Listed as out for Friday,YES,Out,Inflammation,,Not Specified,Ankle,Johnson,"Johnson (ankle) is listed as out for Friday’s game against the Nets, Tom D’Angelo of the Palm Beach Post reports.","Johnson was able to take part in a limited practice session Thursday, so he appears to be nearing a return. That said, the Heat aren't quite ready to bring him back, so he'll sit out Friday, with the hope of then coming back on Saturday against the Magic. With Justise Winslow (knee) also still out, look for the likes of Kelly Olynyk, Bam Adebayo and Jordan Mickey to all fill in with more minutes in the frontcourt.",12/28/2017 8:58:36 AM,201949,F,3,3021,MIA,heat,273946,12/28/2017 8:58:36 AM,james_johnson
73,1514486689,Dirk,Dirk Nowitzki: Scores 15 points in 26 minutes,NO,Healthy,,,,,Nowitzki,"Nowitzki accounted for 15 points (7-10 FG, 1-3 3Pt), seven rebounds, three assists, one steal, and one block in 26 minutes Wednesday in Dallas’ win over Indiana.","Nowitzki is no longer the offensive force he once was, but he is as efficient as ever. In limited opportunities, so far in the 2017-18 season, he has connected on 46.6-percent from the field, 42.4-percent from three-point land, and an astounding 91.3-percent from the charity stripe. Those percentages paired with his solid rebounding numbers (5.5 per game) make him a valuable fantasy asset if you are looking to fill out your roster.",12/28/2017 8:44:49 AM,1717,F,3,1895,DAL,mavericks,273945,12/28/2017 8:44:49 AM,dirk_nowitzki
74,1514486655,Yogi,Yogi Ferrell: Scores 13 points in 31 minutes,NO,Healthy,,,,,Ferrell,"Ferrell scored 13 points (5-8 FG, 2-4 3Pt, 1-2 FT), grabbed three rebounds, dished four assists and recorded one blocks across 31 minutes Wednesday in Dallas’ win against Indiana.","Dallas has strong guard play from top to bottom, and for the most part that limits the fantasy value of each guard on their roster. Five different guards played more than 20 minutes Wednesday, including Ferrell, who bounced back from a poor shooting night against Toronto and led that group of guards in scoring this time out. Unfortunately, Ferrell's fantasy value will be stunted for as long as he is clawing for playing time in such a crowded backcourt.",12/28/2017 8:44:15 AM,1627812,G,3,3924,DAL,mavericks,273944,12/28/2017 8:44:15 AM,yogi_ferrell
75,1514486601,Lance,Lance Stephenson: Scores 16 points in 36 minutes,NO,Healthy,,,,,Stephenson,"Stephenson scored 16 points (7-12 FG, 2-5 3Pt), grabbed 15 rebounds, dished five assists, and collected two steals across 36 minutes Wednesday in Indiana’s loss to Dallas.","With star guard Victor Oladipo (knee) out, Stephenson stepped up in a big way for Indiana. He got the start in Oladipo's absence and posted a double-double. Stephenson has performed well in the role of sixth-man for Indiana. So far in December, he is averaging 9.7 points, 6.2 rebounds, and 3.1 assists. If Oladipo remains out, Stephenson's value will rise as a result of the extended opportunities.",12/28/2017 8:43:21 AM,202362,G,3,3127,IND,pacers,273943,12/28/2017 8:43:21 AM,lance_stephenson
76,1514486565,Myles,Myles Turner: Scores 16 points in 35 minutes,NO,Healthy,,,,,Turner,"Turner accounted for 16 points (6-12 FG, 1-3 3Pt, 3-4 FT), six rebounds, two steals, and two blocks in 35 minutes Wednesday in Indiana’s loss to Dallas.","Turner has proven himself to be a valuable piece for the Pacers as they build for the future, and for fantasy owners. So far in the 2017-18 campaign, he has proven that he can knock down three's with respectable consistency for a big man (35.5-percent on 2.7 attempts per game)  and he is establishing himself as one of the best rim-protectors the league has to offer (2.4 blocks per game).  In the immediate future, the Pacers could look to Turner to carry more of the offensive load until star guard Victor Oladipo (knee) returns to action.",12/28/2017 8:42:45 AM,1626167,C,3,3725,IND,pacers,273942,12/28/2017 8:42:45 AM,myles_turner
77,1514486501,Jeff,Jeff Teague: MRI shows no structural damage,YES,Out,,,Left,Knee,Teague,"An MRI on Teague’s injured knee showed a sprain, but no structural damage, Adrian Wojnarowski of ESPN reports. He’s out indefinitely.","It's hard to predict a timetable for Teague's return based on this report, but it sounds like he's avoided a worst-case scenario for his injury. Teague was helped to the locker room during Wednesday's game after having his left leg rolled up on by Gary Harris during the fourth quarter. Tyus Jones shoulde see a significant uptick in playing time while Teague is out.",12/28/2017 8:41:41 AM,201952,G,1,3025,MIN,timberwolves,273941,12/28/2017 8:41:41 AM,jeff_teague
78,1514484694,Nick,Nick Young: Drains 15 off bench in win,NO,Healthy,,,,,Young,"Young posted 15 points (6-9 FG, 3-4 3Pt), one rebound and one assist across 22 minutes in Wednesday’s 126-101 win over the Jazz.","Young saw some extended playing time with the Warriors enjoying a sizable second-half lead, and he made good use of time on the floor. The veteran guard's shot attempts were his highest since Nov. 24, as was his scoring total. Despite the uptick in production Wednesday, Young has seen under 20 minutes more often than not, limiting his fantasy value to deeper formats and as an occasional DFS punt play.",12/28/2017 8:11:34 AM,201156,G,3,2829,GSW,warriors,273940,12/28/2017 8:11:34 AM,nick_young
79,1514484646,Justise,Justise Winslow: Goes through light practice,YES,Out,Strain,,Left,Knee,Winslow,"Winslow (knee) took part in a light practice Thursday, Ira Winderman of the South Florida Sun Sentinel reports.","Winslow has now missed seven consecutive games, though it appears he may be ramping up his activity. While it was only a light practice session. the fact that he was on the court and going through drills is encouraging that a return is not far off. With the Heat heading into a back-to-back set, it wouldn't be surprising if Winslow was once again held out Friday against the Nets, though tentatively consider him questionable for that matchup until more information is provided.",12/28/2017 8:10:46 AM,1626159,F,3,3719,MIA,heat,273939,12/28/2017 8:10:46 AM,justise_winslow
80,1514484437,Draymond,Draymond Green: Full stat line in win,NO,Healthy,,,,,Green,"Green totaled 14 points (6-10 FG, 2-5 3Pt), eight rebounds and eight assists across 25 minutes in Wednesday’s 126-101 win over the Jazz.","Green posted a typically well-balanced line, one that he generated in particularly efficient fashion considering he logged his lowest minutes total since Oct. 27. The veteran forward has four consecutive double-digit scoring efforts,  and he's taken double-digit shot attempts in three of those contests. While the increased usage is certainly a welcome sight for fantasy owners, it isn't likely to remain the norm once Stephen Curry (ankle) makes his return.",12/28/2017 8:07:17 AM,203110,F,3,3299,GSW,warriors,273938,12/28/2017 8:07:17 AM,draymond_green
81,1514484323,James,James Johnson: Limited at Thursday's practice,YES,Out,Inflammation,,Not Specified,Ankle,Johnson,"Johnson (ankle) was able to take part in portions of Thursday’s practice, Ira Winderman of the South Florida Sun Sentinel reports.","Johnson has missed four of the last five games with an ankle injury, though the fact that he was able to at least go through some of Thursday's practice is encouraging for a return in the near future. With the Heat heading into a back-to-back set over the weekend, there's a chance Johnson is held out in order to limit the overall strain on the ankle, though for now, consider him questionable for Friday's matchup with the Nets.",12/28/2017 8:05:23 AM,201949,F,3,3021,MIA,heat,273937,12/28/2017 8:05:23 AM,james_johnson
82,1514484206,Patrick,Patrick McCaw: Season-high scoring total in win,NO,Healthy,,,,,McCaw,"McCaw tallied 18 points (7-10 FG, 1-3 3Pt, 3-4 FT), four rebounds and one steal across 20 minutes in Wednesday’s 126-101 win over the Jazz.","McCaw headed back to the bench Wednesday, but his hot hand from the field propelled him to a season-high scoring total. It was also McCaw's first double-digit scoring effort since Nov. 27, and his second game over the last three in which he's posted at least a 70.0 percent success rate from the field. The second-year swingman is primarily valued for his defense, however, and as such, the last two games are the only ones all season in which he's put up double-digit shot attempts.",12/28/2017 8:03:26 AM,1627775,G,3,3862,GSW,warriors,273936,12/28/2017 8:03:26 AM,patrick_mccaw
83,1514484117,Willie,Willie Cauley-Stein: Scores 17 points in 36 minutes,NO,Healthy,,,,,Cauley-Stein,"Cauley-Stein scored 17 points (8-14 FG, 1-2 FT), grabbed nine rebounds, dished four assists and recorded one block across 36 minutes Wednesday in Sacramento’s win over Cleveland.","We are in the midst of Cauley-Stein's third NBA season and while he hasn't completely broken through just yet, performances like the one we saw Wednesday provide a glimpse of what he could be. The athletic big has proven he can score, rebound, and block shots, but his lack of consistency tends to limit his playing time. At some point, the Kings will be forced to give Cauley-Stein extended minutes on a consistent basis and see what type of player they have. In the event that he gets more minutes as we head into the second half of the 2017-18 season, he would be a big man worth keeping an eye on.",12/28/2017 8:01:57 AM,1626161,C,3,3740,SAC,kings,273935,12/28/2017 8:01:57 AM,willie_cauley-stein
84,1514484067,Dion,Dion Waiters: Held out of practice Thursday,YES,Out,Sprain,,Left,Ankle,Waiters,"Waiters (ankle) sat out Thursday’s practice, Ira Winderman of the South Florida Sun Sentinel reports.","Waiters has missed the last two games while dealing with an ankle injury and the fact that he wasn't able to practice Thursday doesn't bode well for his availability against the Nets on Friday. He'll likely attempt to test the injury out during Friday's morning shootaround, but the Heat could opt to remain as cautious as possible with Waiters and hold him out once again, especially considering the team is heading into a back-to-back set.",12/28/2017 8:01:07 AM,203079,G,3,3315,MIA,heat,273934,12/28/2017 8:01:07 AM,dion_waiters
85,1514484045,Vince,Vince Carter: Scores 24 points in 30 minutes,NO,Healthy,,,,,Carter,"Carter registered 24 points (10-12 FG, 4-5 3Pt), five rebounds, three assists, one steal, and one block across 30 minutes Wednesday in Sacramento’s win over Cleveland.","Carter erupted for 24 points after not registering any minutes in three consecutive games. The surprise performance from the 40-year-old provided the boost that Sacramento needed to take down Cleveland. Carter hasn't been particularly relevant in fantasy for a few seasons now, but it's clear that the guy can still hoop when given the opportunity.",12/28/2017 8:00:45 AM,1713,G,3,1891,SAC,kings,273933,12/28/2017 8:00:45 AM,vince_carter
86,1514484005,Kevin,Kevin Love: Scores 23 points in 30 minutes,NO,Healthy,,,,,Love,"Love accounted for 23 points (7-12 FG, 3-8 3Pt, 6-6 FT), five rebounds, and two blocks in 30 minutes Wednesday in Cleveland’s loss to Sacramento.","We are through almost half of the 2017-18 campaign and Love is averaging more than 20 points per game, something he has yet to do in a Cleveland uniform for a full season. Fresh off his 31 point Christmas performance Love once again led Cleveland in scoring. He is enjoying his first season shooting above 40-percent from deep while attempting more than three three-pointers per game. If that number remains true, his scoring numbers could remain at this level for the foreseeable future.",12/28/2017 8:00:05 AM,201567,F,3,2931,CLE,cavaliers,273932,12/28/2017 8:00:05 AM,kevin_love
87,1514483959,LeBron,LeBron James: Scores 16 points in 38 minutes,NO,Healthy,,,,,James,"James registered 16 points (6-17 FG, 0-2 3Pt, 4-5 FT), 10 rebounds, 14 assists, and five steals across 38 minutes Wednesday in Cleveland’s loss to Sacramento.","James ended his triple-double drought Wednesday, registering his first since December 17th, 2017. His amazing production has been normalized, and he continues to be the top player in fantasy hoops. So far in the month of December James is averaging 27.4 points on 52.2-percent shooting to go along with 10.4 assists per game.",12/28/2017 7:59:19 AM,2544,F,3,2344,CLE,cavaliers,273931,12/28/2017 7:59:19 AM,lebron_james
88,1514483949,Klay,Klay Thompson: Scoring-heavy stat line in win,NO,Healthy,,,,,Thompson,"Thompson poured in 15 points (5-12 FG, 3-5 3Pt, 2-2 FT), and added one assist and one block across 30 minutes in Wednesday’s 126-101 win over the Jazz.","Thompson's scoring-heavy line left some to be desired fantasy-wise, but it was more than sufficient in what was a comfortable win for the Warriors. The 27-year-old has actually been a serviceable contributor in the area of rebounds and assists throughout December, so Wednesday's line was more or less an outlier. Thompson is now averaging 21.2 points, 3.9 rebounds and 2.8 assists across 35.6 minutes in 13 games during the month.",12/28/2017 7:59:09 AM,202691,G,3,3197,GSW,warriors,273930,12/28/2017 7:59:09 AM,klay_thompson
89,1514483709,Kevin,Kevin Durant: Efficient in modest playing time,NO,Healthy,,,,,Durant,"Durant contributed 21 points (7-10 FG, 2-3 3Pt, 5-5 FT), six rebounds, four assists and three blocks across 29 minutes in Wednesday’s 126-101 win over the Jazz.","The perennial All-Star didn't have to exert himself too much in the blowout win, and with the Warriors enjoying a sizable second-half lead, he enjoyed the benefit of more rest than usual. Durant's stellar play has prevented the Warriors from missing a beat during Stephen Curry's extended absence due to an ankle injury, and with the latter reportedly nearing  a return, Durant's fantasy owners can expect a slight drop in the sky-high usage rate he's sported as the Warriors' primary scorer recently.",12/28/2017 7:55:09 AM,201142,F,3,2811,GSW,warriors,273929,12/28/2017 7:55:09 AM,kevin_durant
90,1514483510,Thabo,Thabo Sefolosha: Fills out stat sheet in spot start,NO,Healthy,,,,,Sefolosha,"Sefolosha tallied 11 points (4-12 FG, 1-2 3Pt, 2-2 FT), eight rebounds, one assist, two steals and one block across 33 minutes in Wednesday’s 126-101 loss to the Warriors.","Sefolosha did well with a rare starting opportunity in place of Jonas Jerebko, producing his fourth double-digit scoring effort in his last six games in the process. The veteran has typically come off the bench and offers some inconsistent offensive production in points and rebounds, keeping his fantasy value limited to deeper formats. However, he certainly remains capable of the occasional double-digit scoring tally, particularly when seeing a higher allotment of playing time than customary. It remains to be seen if Sefolosha will find himself in the first unit again when the Jazz tangle with the Cavaliers on Saturday night.",12/28/2017 7:51:50 AM,200757,F,3,2732,UTA,jazz,273928,12/28/2017 7:51:50 AM,thabo_sefolosha
91,1514483252,Donovan,Donovan Mitchell: Pitches in with 17 points in loss,NO,Healthy,,,,,Mitchell,"Mitchell collected 17 points (6-17 FG, 1-6 3Pt, 4-5 FT), seven rebounds, three assists, two steals and one block across 35 minutes in Wednesday’s 126-101 loss to the Warriors.","The rookie had a rough shooting night overall, but volume helped him get to a double-digit scoring tally for the third straight contest. Mitchell has gone cold from three-point range recently, however, as factoring in Wednesday's contest, he's posted an unsightly 23.1 percent from behind the arc over his last three games. Despite those struggles, his ability to contribute across the stat sheet keeps him highly valued across all formats.",12/28/2017 7:47:32 AM,1628378,G,3,4166,UTA,jazz,273927,12/28/2017 7:47:32 AM,
92,1514482994,Derrick,Derrick Favors: Posts 17 points in blowout loss,NO,Healthy,,,,,Favors,"Favors generated 17 points (7-11 FG, 3-4 FT), 10 rebounds and one assist across 26 minutes in Wednesday’s 126-101 loss to the Warriors.","Favors continues to do his part in trying to make up for the loss of Rudy Gobert (knee), with Wednesday's effort representing his fourth consecutive double-digit scoring effort. It was also the veteran big man's first double-double since Nov. 30, but he's hauled in between six and 12 rebounds in nine of his last 13 games overall. Favors has also unsurprisingly upped his offensive involvement in recent games, taking double-digit shot attempts in three of his last four contests. Given what should continue to be an expanded role during Gobert's multi-week absence, his fantasy stock remains at what is likely its highest point of the season.",12/28/2017 7:43:14 AM,202324,F,3,3107,UTA,jazz,273926,12/28/2017 7:43:14 AM,derrick_favors
93,1514482739,Rodney,Rodney Hood: Pours in 26 points off bench,NO,Healthy,,,,,Hood,"Hood went for 26 points (9-20 FG, 2-5 3Pt, 6-8 FT), five rebounds and three steals across 29 minutes in Wednesday’s 126-101 loss to the Warriors.","Hood's scoring total was easily a team high on a rough night for the Jazz. The fourth-year guard has mostly thrived since moving to the bench, despite some rough shooting nights on occasion. Factoring in Wednesday's tally, Hood has produced double-digit scoring efforts in eight of his last nine contests, and he's drained multiple threes in all nine of those games. Given that he's seen no less than 25 minutes since Nov. 15, he remains a worthy fantasy asset in all formats for his scoring contributions in particular.",12/28/2017 7:38:59 AM,203918,G,3,3591,UTA,jazz,273925,12/28/2017 7:38:59 AM,rodney_hood
94,1514482452,Carmelo,Carmelo Anthony: Pours in 18 in complementary role,NO,Healthy,,,,,Anthony,"Anthony contributed 18 points (8-15 FG, 0-4 3Pt, 2-2 FT), four rebounds, four assists and one steal across 31 minutes in Wednesday’s 124-107 win over the Raptors.","With Paul George and Russell Westbrook combining for 32 shot attempts and 63 points, Anthony played more of a complementary role alongside his prolific teammates. Such has been the case on many occasions this season, but with the Thunder starting to pick up significant momentum after an inconsistent start, there's no reason to change up the formula. Even with the drop in usage, Anthony is still averaging a solid 17.6 points, 6.1 rebounds and 1.6 assists, and fantasy owners who'd tempered their expectations accordingly regarding the inevitable reduction in his offensive role upon joining Westbrook and George have to be satisfied with his overall production.",12/28/2017 7:34:12 AM,2546,F,3,2351,OKC,thunder,273924,12/28/2017 7:34:12 AM,carmelo_anthony
95,1514482452,Ish,Ish Smith: Starting at point guard Thursday,NO,Healthy,,,,,Smith,"Smith will start at point guard for Thursday’s game against the Magic, Rod Beard of the Detroit News reports.","The Pistons recently lost Reggie Jackson for 6-to-8 weeks because of a severe ankle sprain, so Smith will start Thursday and should remain there for the foreseeable future. Fantasy owners should definitely give Smith a look as a speculative add if in need of some guard depth, as Smith has proven in the past that he's capable of putting up some strong numbers when given the opportunity. Along with Smith, Langston Galloway is expected to see added run as the team's backup point guard.",12/28/2017 7:34:12 AM,202397,G,3,3175,DET,pistons,273923,12/28/2017 7:34:12 AM,ish_smith
96,1514482343,Avery,Avery Bradley: Returns to basketball activities,YES,Out,Strain,,Right,Groin,Bradley,"Bradley (groin) returned to basketball activities Thursday, Rod Beard of the Detroit News reports.","Bradley has been out since Dec. 14 with a strained right groin, but the Pistons are encouraged by his recent progress, and the expectation is that he could be back with the team sometime next week. Earlier this month, the Pistons threw out Jan. 1 as a rough return date, and while they're off that day, Detroit does play Jan. 3 in Miami. If Bradley were to return for that contest, he'd only miss two more games: Thursday at Orlando and Saturday vs. San Antonio.",12/28/2017 7:32:23 AM,202340,G,3,3112,DET,pistons,273922,12/28/2017 7:32:23 AM,avery_bradley
