,Date,FirstName,Headline,Injured,Injured_Status,Injury_Detail,Injury_Location,Injury_Side,Injury_Type,LastName,ListItemCaption,ListItemDescription,ListItemPubDate,PlayerID,Position,Priority,RotoId,Team,TeamCode,UpdateId,lastUpdate,player_code
33,1514514999,Damian,Damian Lillard: Out Thursday vs. 76ers,YES,Out,Strain,,Right,Hamstring,Lillard,"Lillard (hamstring) has been ruled out for Thursday’s game against the 76ers, Casey Holdahl of the Trail Blazers’ official site reports.",Lillard went through pregame warmups but will nonetheless miss his third consecutive contest due to a hamstring strain. Shabazz Napier replaced Lillard in the starting lineup Saturday against the Lakers and appears to be the best candidate to do so again Thursday night. Lillard's next opportunity to take the court will be Saturday when the Trail Blazers square off against the Hawks.,12/28/2017 4:36:39 PM,203081,G,2,3304,POR,blazers,273985,12/28/2017 4:36:39 PM,damian_lillard
34,1514512229,Tony,Tony Bradley: Recalled from G-League,NO,Healthy,,,,,Bradley,Bradley was recalled from the G-League on Thursday.,Bradley returns to the Jazz and will resume his role as a depth option off the bench. He has only played in eight games this season for the Jazz and isn't likely to reach fantasy relevance anytime soon.,12/28/2017 3:50:29 PM,1628396,C,3,4170,UTA,jazz,273984,12/28/2017 3:50:29 PM,
35,1514511237,Kyle,Kyle Anderson: Starting Thursday,NO,Healthy,,,,,Anderson,"Anderson will start at small forward Thursday against the Knicks, Jeff McDonald of the San Antonio Express-News reports.","With Kawhi Leonard (rest) sidelined, Anderson will return to a starting role Thursday. He is averaging 8.8 points, 5.9 boards, and 3.0 assists, across 27.4 minutes in 24 starts this season.",12/28/2017 3:33:57 PM,203937,F,3,3586,SAS,spurs,273983,12/28/2017 3:33:57 PM,kyle_anderson
36,1514509227,Tyus,Tyus Jones: Starting Thursday,NO,Healthy,,,,,Jones,"Jones will get the start at point guard for Thursday’s game against the Bucks,","As expected, Jones will replace Jeff Teague (knee) in the starting lineup. Teague is expected to miss 2-4 weeks, so Jones will have an opportunity to see an increased workload during that span. The Duke product has produced 12.3 points, 4.0 rebounds, and 6.7 assists across 40.0 minutes per game in three starts this season. He is worth a pick up for some short-term help in standard leagues, as well as a solid DFS play until his price catches up to his expected increased production.",12/28/2017 3:00:27 PM,1626145,G,3,3739,MIN,timberwolves,273982,12/28/2017 3:00:27 PM,tyus_jones
37,1514508971,LaMarcus,LaMarcus Aldridge: Will play Thursday vs. Knicks,NO,Healthy,,,,,Aldridge,"Aldridge will play Thursday against the Knicks, Jeff McDonald of the San Antonio Express-News reports.","There were rumblings that Aldridge would be rested against the Knicks but he will take the court. Aldridge is coming off a 20-point, nine-rebound performance against the Nets on Tuesday, in which he logged 34 minutes. Look for the veteran to play in his regular starting role alongside Pau Gasol in the frontcourt.",12/28/2017 2:56:11 PM,200746,F,3,2502,SAS,spurs,273981,12/28/2017 2:56:11 PM,lamarcus_aldridge
38,1514508510,Kawhi,Kawhi Leonard: Out Thursday,YES,Out,Not Specified,,Not Specified,Rest,Leonard,"Leonard (rest) will not play in Thursday’s game against the Knicks, Marc Berman of the New York Post","Although the Spurs originally labeled Leonard as questionable for the contest, they will ultimately err on the side of caution and sit him. It continues a trend of four straight games missed following a game played for the star wing.  He logged a season-high 26 minutes in Tuesday's victory over the Nets, and will shoot for a Saturday against the Pistons. Kyle Anderson and Rudy Gay figure to continue benefiting from Leonard's absence.",12/28/2017 2:48:30 PM,202695,F,2,3195,SAS,spurs,273980,12/28/2017 2:48:30 PM,kawhi_leonard
39,1514505760,Kawhi,Kawhi Leonard: Status uncertain for Thursday,YES,Out,Not Specified,,Not Specified,Rest,Leonard,"Leonard’s (rest) status is uncertain for Thursday’s game against the Knicks, Al Iannazzone of Newsday Sports reports.","Leonard was originally considered probable Thursday, though it now appears that coach Gregg Popovich is giving some serious thought to having his star sit out. For now, Leonard is likely closer to questionable than probable and we may not get final word on his availability until right before tip-off. If Leonard is ultimately rested, Rudy Gay and Kyle Anderson would likely pick up some extra minutes.",12/28/2017 2:02:40 PM,202695,F,2,3195,SAS,spurs,273979,12/28/2017 2:02:40 PM,kawhi_leonard
40,1514505608,Aaron,Aaron Brooks: Available Thursday vs. Bucks,NO,Healthy,,,,,Brooks,"Brooks (illness) will be available for Thursday’s game against the Bucks, Wolves radio voice Alan Horton reports.","Brooks missed Wednesday's win over Denver due to an illness, but he'll again be an option off the bench for coach Tom Thibodeau on Thursday. The veteran has not been a part of the regular rotation this season, but he could see a bit of a bump in minutes in the wake of Jeff Teague's knee injury, which will likely keep him out for 2-to-4 weeks.",12/28/2017 2:00:08 PM,201166,G,3,2842,MIN,timberwolves,273978,12/28/2017 2:00:08 PM,aaron_brooks
41,1514505456,LaMarcus,LaMarcus Aldridge: Could be rested Thursday,NO,Healthy,Not Specified,,Not Specified,Rest,Aldridge,"Aldridge could be rested for Thursday’s game against the Knicks, Stefan Bondy of the New York Daily News reports.","The situation is still a bit unclear, but Bondy reports that the Spurs are still ""waiting to see"" if Aldridge will play, which implies that he could be rested. A more definitive update on the 32-year-old should be available closer to the 7:30PM ET tip.",12/28/2017 1:57:36 PM,200746,F,3,2502,SAS,spurs,273977,12/28/2017 1:57:36 PM,lamarcus_aldridge
42,1514504811,Chris,"Chris Paul: Out Thursday, uncertain for Friday",YES,Out,Strain,,Left,Leg,Paul,"Paul (leg), who’s already been ruled out for Thursday’s game against the Celtics, is questionable for Friday’s matchup with the Wizards, Jonathan Feigen of the Houston Chronicle reports.","Paul is set to miss his third straight game Thursday, though from the sounds of it he's closing in on a return. According to coach Mike D'Antoni, Paul could play Friday against the Wizards, but if he's unable to, he'd then be probable to play on Sunday against the Lakers. For that reason, fantasy owners can expect to have Paul back at some point over the next few games, though look for further updates following Friday's morning shootaround.",12/28/2017 1:46:51 PM,101108,G,2,2584,HOU,rockets,273976,12/28/2017 1:46:51 PM,chris_paul
43,1514504654,Jeff,Jeff Teague: Expected to miss 2-to-4 weeks,YES,Out,,,Left,Knee,Teague,"Teague (knee) is expected to miss 2-to-4 weeks with a sprained left knee, ESPN’s Adrian Wojnarowski reports.","Teague left Wednesday's game with what initially appeared to be a serious knee injury, but a subsequent MRI revealed only a Grade 1 MCL sprain. While Teague will still miss several weeks, the diagnosis is somewhat of a relief for the Wolves, who are expected to pivot to Tyus Jones at point guard for the time being. Assuming Teague is back sometime in mid-January, he'll likely miss somewhere around 10-15 games.",12/28/2017 1:44:14 PM,201952,G,3,3025,MIN,timberwolves,273975,12/28/2017 1:44:14 PM,jeff_teague
44,1514504298,Gerald,Gerald Green: Will be available,NO,Healthy,,,,,Green,"Green will be available for Thursday’s game against Boston, Scott Souza of the Providence Journal reports.","Green signed with the Rockets mere hours ago, but with the team playing in Boston -- where Green resides after spending last season with the Celtics -- the veteran will be in uniform and available off the bench. Houston will be without Troy Williams and Luc Richard Mbah a Moute, so it's possible Green could pick up a few spot minutes, but he's highly unlikely to make a tangible fantasy impact.",12/28/2017 1:38:18 PM,101123,G,3,2588,HOU,rockets,273974,12/28/2017 1:38:18 PM,gerald_green
45,1514504262,Marcus,Marcus Morris: To remain on minutes restriction,NO,Healthy,,,,,Morris,"Morris (knee) is expected to see limited minutes in his return for Thursday’s matchup with the Rockets, Jay King of MassLive.com reports.","Coach Brad Stevens indicated that he was likely going to play Morris similar minutes to his last time out, which would be right around that 16-minute mark. Considering Morris should only see minutes in the upper teens, it will likely be wise to avoid him for Thursday's DFS slate. Look for Morris to slowly increase his workload over the next few weeks.",12/28/2017 1:37:42 PM,202694,F,3,3198,BOS,celtics,273973,12/28/2017 1:37:42 PM,marcus_morris
46,1514503973,Mario,Mario Hezonja: Shifting back to bench Thursday,NO,Healthy,,,,,Hezonja,"Hezonja will shift back to a bench role for Thursday’s matchup with the Pistons, John Denton of OrlandoMagic.com reports.","The Magic are finally getting back some key injured players, with both Evan Fournier (foot) and Aaron Gordon (calf) getting the green light to play. While it's a positive for the Magic, it's not so good in terms of Hezonja's fantasy value, as he's expected to shift back to the bench and see a sizable decrease in his overall workload. Prior to the injuries, Hezonja was typically seeing minutes in the mid-teens on a good night, so there will likely be better options out there to pursue for fantasy value.",12/28/2017 1:32:53 PM,1626209,G,3,3578,ORL,magic,273972,12/28/2017 1:32:53 PM,mario_hezonja
47,1514503753,Evan,Evan Fournier: Good to go Thursday vs. Pistons,NO,Healthy,,,,,Fournier,"Fournier (foot) will play and start Thursday’s game against the Pistons, John Denton of OrlandoMagic.com reports.","Fournier made it through warmups without any issues, so he'll take the court in his usual starting role Thursday and doesn't expect to have any limitations. Fantasy owners should feel comfortable activating him as usual considering the full workload. With Fournier and Aaron Gordon (calf) playing, Mario Hezonja will move to the bench and see a sizable decrease in his overall workload.",12/28/2017 1:29:13 PM,203095,G,3,3317,ORL,magic,273971,12/28/2017 1:29:13 PM,evan_fournier
48,1514503585,Aaron,"Aaron Gordon: Will play, start Thursday vs. Pistons",NO,Healthy,,,,,Gordon,"Gordon (calf) will play and start Thursday’s game against the Pistons, John Denton of OrlandoMagic.com reports.","Gordon will be making his return from a five-game absence and will immediately jump back into his typical starting power forward role. Coach Frank Vogel indicated that he expected Gordon to see a full workload if cleared, so it doesn't sound like he'll have any limitations and fantasy owners can go ahead and activate him Thursday. This also shifts Mario Hezonja back to the bench and means a significant drop in playing time and fantasy value for him.",12/28/2017 1:26:25 PM,203932,F,2,3577,ORL,magic,273970,12/28/2017 1:26:25 PM,aaron_gordon
49,1514500526,Evan,Evan Fournier: Expected to play Thursday,NO,Healthy,Soreness,,Right,Foot,Fournier,"Fournier (foot) is expected to play in Thursday’s game against the Pistons, Josh Robbins of the Orlando Sentinel reports.","Fournier just needs to make it through pregame warmups to be cleared, so he should be in the lineup once again Thursday. On Tuesday against the Heat, Fournier logged 30 minutes and he'd likely see a similar number Thursday if he plays as expected. Fellow starter Aaron Gordon (calf) is also planning on returning, so the Magic finally appear to be getting healthy after being decimated by injuries for weeks.",12/28/2017 12:35:26 PM,203095,G,2,3317,ORL,magic,273969,12/28/2017 12:35:26 PM,evan_fournier
50,1514500352,Isaiah,Isaiah Thomas: Set for full-speed practice Friday,YES,Out,Soreness,,Right,Hip,Thomas,"Thomas (hip) will go through a full-speed, five-on-five practice Friday with the Cavaliers, ESPN reports.","It's relatively rare for NBA teams to hold a full practice while on a road trip, but that's exactly what the Cavs will do Friday, specifically to get Thomas some experience scrimmaging with his teammates. ""It'll be a practice, get some shots up, cover defensive rules and principles and also scrimmage a little bit so Isaiah can get a feel and play 5-on-5,"" coach Tyronn Lue said Wednesday. Thomas has ramped up his activity of late and even spent some time with the Cavs' G-League affiliate, but, to date, his recovery from hip surgery has prevented him from participating in full speed work with his new teammates. The assumption is that if all goes well, there's a chance Thomas could be cleared to make his Cavaliers debut Saturday in Utah. That's still very much up in the air, however, and it's certainly possible Cleveland could wait until sometime after the New Year. Following Saturday's contest, the Cavs are off Sunday and Monday before hosting the Blazers on Tuesday night. ""When that time comes to where I'll be out there, I'm sure everybody is going to know and I'll be out there playing the way I've always played,"" Thomas said. ""I'm just trying to get as close as 100 percent as possible and to be out there to be special. Not just to be out there and be another body. However long that takes -- it might be next week, it might be a week after that. We don't know and we're really not trying to put a date on it because it just depends on how my recovery is.""",12/28/2017 12:32:32 PM,202738,G,2,3240,CLE,cavaliers,273968,12/28/2017 12:32:32 PM,isaiah_thomas
51,1514500212,Aaron,Aaron Gordon: Expected to play Thursday,NO,Healthy,Strain,,Right,Calf,Gordon,"Gordon (calf) is expected to play in Thursday’s game against the Pistons, Josh Robbins of the Orlando Sentinel reports.","After missing the last five games with a calf injury, Gordon appears ready to take the floor, though he'll still have to make it through pregame warmups without incident first. If that does happen as expected, Gordon will immediately jump into the starting lineup, although the Magic haven't provided any more info on his potential workload. Look for a final confirmation just before tip-off, but if Gordon does play as expected, Mario Hezonja would head back to the bench and see a significant decrease in his overall workload.",12/28/2017 12:30:12 PM,203932,F,2,3577,ORL,magic,273967,12/28/2017 12:30:12 PM,aaron_gordon
52,1514499785,Blake,Blake Griffin: Officially questionable for Friday,YES,GTD,Not Specified,,Left,Knee,Griffin,"Griffin (knee) is officially listed as questionable for Friday’s game against the Lakers, Arash Markazi of ESPN reports.","Griffin practiced with the Clippers' G-League affiliate Wednesday, though there's been no word on how the knee responded to the increase in activity. Still, the fact that he's been upgraded to questionable for Friday is encouraging and there's now a realistic chance he returns to action after sitting out for roughly the past month. Look for another update to be provided after the team goes through morning shootaround, though if he does take the court, he'd likely have some hefty restrictions early on to ease him back into the swing of things.",12/28/2017 12:23:05 PM,201933,F,2,3016,LAC,clippers,273966,12/28/2017 12:23:05 PM,blake_griffin
53,1514498114,Ivica,Ivica Zubac: Sent to G-League,NO,Healthy,,,,,Zubac,Zubac was assigned to the G-League on Thursday.,"Zubac hasn't seen the floor over the last 10 games for the Lakers, even with Brook Lopez (ankle) on the sidelines, so he's clearly well outside the regular rotation. For that reason, the Lakers will ship him to the G-League to give him a chance to see some extended playing time. Continue to avoid Zubac in fantasy leagues moving forward.",12/28/2017 11:55:14 AM,162726,C,4,3888,LAL,lakers,273965,12/28/2017 11:55:14 AM,
54,1514497879,Jeff,Jeff Teague: Dealing with Grade 1 MCL sprain,YES,Out,,,Left,Knee,Teague,"Teague has officially been diagnosed with a Grade 1 MCL sprain in his left knee and is out indefinitely, Timberwolves radio play-by-play announcer Alan Horton reports.","The Timberwolves listing Teague's injury as a Grade 1 sprain is encouraging, as that's the most mild of the classifications. However, while Minnesota won't provide an exact timetable for a return, this sort of injury typically takes at least a few weeks to recover from, so Teague should be out for the foreseeable future. With Teague on the shelf moving forward, Tyus Jones will move into the starting lineup and should be considered a candidate to pick up in season-long leagues, as he'll be set for a 30-plus-minutes role. Look for more updates on Teague as he moves through the recovery process.",12/28/2017 11:51:19 AM,201952,G,2,3025,MIN,timberwolves,273964,12/28/2017 11:51:19 AM,jeff_teague
55,1514497332,Noah,Noah Vonleh: Out Thursday vs. 76ers,YES,Out,Dislocated,,,Finger,Vonleh,"Vonleh (finger) has been ruled out for Thursday’s game against the 76ers, Casey Holdahl of TrailBlazers.com reports.","Vonleh is dealing with a dislocated finger and will now miss his second game in a row because of it. He'll have another two days off for rest ahead of Saturday's matchup with the Hawks, though tentatively consider him questionable for that contest as well. Vonleh's absence shouldn't have a drastic impact on the regular rotation considering he's seen single-digit minutes in each of the last four games he's played.",12/28/2017 11:42:12 AM,203943,F,3,3576,POR,blazers,273963,12/28/2017 11:42:12 AM,noah_vonleh
56,1514497059,Damian,Damian Lillard: Downgraded to questionable Thursday,YES,Out,Strain,,Right,Hamstring,Lillard,"Lillard (hamstring) has been downgraded to questionable for Thursday’s matchup with the 76ers, Mike Richman of the Oregonian reports.","Lillard missed the last two games with a hamstring injury, but the Trail Blazers indicated earlier this week that he'd back for Thursday's contest. However, Lillard is now a late addition back on to the injury report and he'll likely now test out the injury during pregame warmups before a final decision is made on his availability. If Lillard ends up being held out, Shabazz Napier would likely be tasked with another start in the backcourt.",12/28/2017 11:37:39 AM,203081,G,2,3304,POR,blazers,273962,12/28/2017 11:37:39 AM,damian_lillard
57,1514496773,Thomas,Thomas Bryant: Assigned to G-League,NO,Healthy,,,,,Bryant,Bryant was assigned to the G-League on Thursday.,"Bryant has seen action in just one game with the Lakers this season, so he'll head to the G-League to work on his overall development in an in-game situation. Look for Bryant to continue to move back and forth between the two rosters, though his lack of playing time at the big league level will keep him off the fantasy radar.",12/28/2017 11:32:53 AM,1628418,C,4,4155,LAL,lakers,273961,12/28/2017 11:32:53 AM,
58,1514496523,Caris,Caris LeVert: Questionable for Friday,YES,GTD,Bruise,,Right,Hip,LeVert,"LeVert is dealing with a right hip pointer and is listed as questionable for Friday’s game against the Heat, Brian Lewis of the New York Post reports.","It's unclear exactly when LeVert picked up the injury, though it was likely during Wednesday's game against the Pelicans. The fact that he's not being ruled out a day in advance is encouraging that it's not an overly serious issue, but he could still be held out, so it'll be a situation to monitor. Look for another update following Friday's morning shootaround and if he can't give it a go, that'd mean more minutes for the likes of Allen Crabbe, DeMarre Carroll and Joe Harris.",12/28/2017 11:28:43 AM,1627747,F,3,3914,BKN,nets,273960,12/28/2017 11:28:43 AM,caris_levert
59,1514495264,Omri,Omri Casspi: Questionable for Friday,YES,GTD,,,Right,Ankle,Casspi,"Casspi (ankle) is listed as questionable for Friday’s game against the Hornets, Mark Medina of the Mercury News reports.","Casspi sprained his right ankle during Wednesday's tilt with the Jazz, but it's reportedly not serious enough to need X-rays, so Casspi shouldn't miss extended time, if any at all. Look for another update following Friday's morning shootaround, though if he can't give it a go, that'd likely mean a few more minutes for guys like Nick Young and Patrick McCaw.",12/28/2017 11:07:44 AM,201956,F,3,2987,GSW,warriors,273959,12/28/2017 11:07:44 AM,omri_casspi
60,1514494444,Wesley,Wesley Johnson: Listed as questionable for Friday,YES,GTD,,,,Foot,Johnson,"Johnson (foot) is listed as questionable for Friday’s game against the Lakers, Elliott Teaford of Southern California News Group reports.","Johnson has been on the sidelines for five straight games while working his way back from a foot injury, but is apparently feeling better and is now nearing a return. He'll target Friday to do so, though he'll likely have to test everything out during morning shootaround before a decision is made on his availability. If Johnson is ultimately cleared, he'd likely move back into the starting lineup and it'd mean less minutes for the likes of Jamil Wilson and Sam Dekker.",12/28/2017 10:54:04 AM,202325,F,3,3101,LAC,clippers,273958,12/28/2017 10:54:04 AM,wesley_johnson
61,1514494145,Cristiano,Cristiano Felicio: Sent to G-League,NO,Healthy,,,,,Felicio,Felicio was assigned to the G-League on Thursday.,"Felicio has seen the court in just two of the Bulls last eight games, playing a total of 12 minutes. For that reason, he'll be sent to the team's G-League affiliate, where Felicio should be given added opportunities to hone his craft. Once recalled, Felicio will merely be a depth option in the frontcourt and shouldn't be relied upon for fantasy purposes.",12/28/2017 10:49:05 AM,1626245,C,4,3651,CHI,bulls,273957,12/28/2017 10:49:05 AM,cristiano_felicio
62,1514493877,Danuel,Danuel House: Assigned to G-League,NO,Healthy,,,,,House,"House was assigned to the G-League on Thursday, Scott Bordow of the Arizona Republic reports.","House signed a two-way contract with the Suns at the start of December and has actually seen some run, averaging 12.7 minutes across seven games. However, he picked up a DNP-CD on Tuesday and will now head to the G-League in order to get some extra playing time and opportunities to work on his overall development. He'll remain off the fantasy radar for the time being.",12/28/2017 10:44:37 AM,1627863,F,4,3949,PHX,suns,273956,12/28/2017 10:44:37 AM,danuel_house
63,1514493531,Stephen,Stephen Curry: Targeting Saturday for return,YES,Out,Not Specified,,Right,Ankle,Curry,"Curry (ankle) is taking part in a scrimmage Thursday and is targeting a return for Saturday’s game against the Grizzlies, Melissa Rohlin of Bay Area News Group reports.","Coach Steve Kerr essentially confirmed that Curry will remain out tomorrow and then if all goes well with the increase in activity, Curry should be back in the lineup Saturday. Look for official confirmation come game day, though fantasy owners should get ready to activate him in the near future. Curry could have some restrictions early on following an extended absence, so that will be something to look out for once he does get the green light. Look for the likes of Shaun Livingston and Patrick McCaw to once again have an expanded role Friday, before seeing a much smaller workload when Curry returns Saturday.",12/28/2017 10:38:51 AM,201939,G,1,3014,GSW,warriors,273955,12/28/2017 10:38:51 AM,stephen_curry
64,1514493114,Davon,Davon Reed: Sent for G-League rehab stint,YES,Out,,,Left,Knee,Reed,"Reed (knee) was assigned to the G-League on Thursday, Scott Bordow of the Arizona Republic reports.","Reed underwent surgery on a torn left meniscus back at the end of August and has spent the entire season thus far rehabbing from it. However, he's now nearing a full recovery and the Suns will assign him to the G-League in order to get some extra practice sessions in and eventually a few games under his belt. Once he does that, the Suns are then expected to reevaluate him and see if he's ready for some action with the big club. That said, Reed should be nothing more than a depth option in the backcourt and likely won't hold much fantasy value once cleared.",12/28/2017 10:31:54 AM,,G,3,4196,PHX,suns,273954,12/28/2017 10:31:54 AM,
65,1514492783,Kyle,Kyle Kuzma: Questionable for Friday,YES,GTD,Soreness,,,Quadriceps,Kuzma,"Kuzma is dealing with a quad injury and is considered questionable for Friday’s game against the Clippers, Tania Ganguli of the Los Angeles Times reports.","Kuzma reportedly suffered the injury during Wednesday's tilt with the Grizzlies and the Lakers could opt to take a cautious approach with their prized rookie and hold him out. However, look for Kuzma to test it out during Friday's morning shootaround, and potentially pregame warmups, before a final decision is made on his availability. If Kuzma has to sit out, Julius Randle and Larry Nance would likely take on bigger roles in the frontcourt.",12/28/2017 10:26:23 AM,1628398,F,3,4167,LAL,lakers,273953,12/28/2017 10:26:23 AM,
